-- phpMyAdmin SQL Dump
-- version 4.9.0.1
-- https://www.phpmyadmin.net/
--
-- Host: 127.0.0.1
-- Generation Time: Feb 14, 2020 at 07:35 AM
-- Server version: 10.4.6-MariaDB
-- PHP Version: 7.1.32

SET SQL_MODE = "NO_AUTO_VALUE_ON_ZERO";
SET AUTOCOMMIT = 0;
START TRANSACTION;
SET time_zone = "+00:00";


/*!40101 SET @OLD_CHARACTER_SET_CLIENT=@@CHARACTER_SET_CLIENT */;
/*!40101 SET @OLD_CHARACTER_SET_RESULTS=@@CHARACTER_SET_RESULTS */;
/*!40101 SET @OLD_COLLATION_CONNECTION=@@COLLATION_CONNECTION */;
/*!40101 SET NAMES utf8mb4 */;

--
-- Database: `journey_wheels`
--

-- --------------------------------------------------------

--
-- Table structure for table `admins`
--

CREATE TABLE `admins` (
  `admin_id` int(11) NOT NULL,
  `admin_name` text NOT NULL,
  `admin_email` text NOT NULL,
  `admin_pass` text NOT NULL,
  `admin_image` text NOT NULL,
  `admin_contact` text NOT NULL
) ENGINE=MyISAM DEFAULT CHARSET=latin1;

--
-- Dumping data for table `admins`
--

INSERT INTO `admins` (`admin_id`, `admin_name`, `admin_email`, `admin_pass`, `admin_image`, `admin_contact`) VALUES
(1, 'VGS', 'sumithravgs@gmail.com', 'vgss', 'Graphic7 (1).jpg', '8106454599'),
(4, 'SAI KRISHNA KATAKAM', 'SAIKATAKAM999@GMAIL.COM', 'Saisrk@94', 'royal-enfield-thunderbird-350x-roving-red.png', '7207444448'),
(5, 'journey wheels', 'contactjourneywheels@gmail.com', '8106454599', '2018-Yamaha-MT-07-Test-beginner-sport-motorcycle-5.jpg', '8977770505');

-- --------------------------------------------------------

--
-- Table structure for table `bicycles`
--

CREATE TABLE `bicycles` (
  `id` int(11) NOT NULL,
  `product_title` text NOT NULL,
  `product_img` text NOT NULL,
  `price` int(11) NOT NULL,
  `cat_id` int(11) NOT NULL,
  `location` text NOT NULL,
  `availability` text NOT NULL,
  `kmlimit` int(11) NOT NULL,
  `excess` int(11) NOT NULL
) ENGINE=MyISAM DEFAULT CHARSET=latin1;

--
-- Dumping data for table `bicycles`
--

INSERT INTO `bicycles` (`id`, `product_title`, `product_img`, `price`, `cat_id`, `location`, `availability`, `kmlimit`, `excess`) VALUES
(2, 'Bi-Cycle', 'bicycle1.jpg', 2, 1, '1', '1', 0, 0);

-- --------------------------------------------------------

--
-- Table structure for table `bicycles_orders`
--

CREATE TABLE `bicycles_orders` (
  `id` int(11) NOT NULL,
  `razorpay_order_id` text NOT NULL,
  `payment_id` text NOT NULL,
  `customer_id` int(11) NOT NULL,
  `vehicle_title` text NOT NULL,
  `vehicle_id` int(11) NOT NULL,
  `pick_location` text NOT NULL,
  `pick_datetime` text NOT NULL,
  `drop_location` text NOT NULL,
  `drop_datetime` text NOT NULL,
  `location` text NOT NULL,
  `order_date` timestamp NOT NULL DEFAULT current_timestamp() ON UPDATE current_timestamp(),
  `amount` text NOT NULL,
  `email` text NOT NULL,
  `contact_no` text NOT NULL,
  `name` text NOT NULL,
  `rent` text NOT NULL,
  `tax` text NOT NULL,
  `tax1` text NOT NULL
) ENGINE=MyISAM DEFAULT CHARSET=latin1;

--
-- Dumping data for table `bicycles_orders`
--

INSERT INTO `bicycles_orders` (`id`, `razorpay_order_id`, `payment_id`, `customer_id`, `vehicle_title`, `vehicle_id`, `pick_location`, `pick_datetime`, `drop_location`, `drop_datetime`, `location`, `order_date`, `amount`, `email`, `contact_no`, `name`, `rent`, `tax`, `tax1`) VALUES
(1, 'order_C3jxkPTvVSVF47', 'pay_C3jz6PAg9YeaRC', 7, 'BICYCLE', 4, 'Journey Wheels Office', '05/03/2019 19:58', '  Journey Wheels Office', '06/03/2019 20:01', '2', '2019-03-05 14:33:43', '1', 'saikatakam999@gmail.com', '9391090908', 'SAIKRISHNA KATAKAM', '1.0', '0.0', '0.0'),
(2, 'order_C4KTZu7vehA4bp', 'pay_C4KU2skhZsFvBa', 7, 'BICYCLE', 4, 'Journey Wheels Office', '07/03/2019 07:44', '  Journey Wheels Office', '08/03/2019 07:44', '2', '2019-03-07 02:16:10', '1', 'saikatakam999@gmail.com', '9391090908', 'SAIKRISHNA KATAKAM', '1.0', '0.0', '0.0'),
(3, 'order_C4T33tAbVkxcUR', 'pay_C4T3S4GcmEteqm', 7, 'BICYCLE', 4, 'Journey Wheels Office', '07/03/2019 16:07', '  Journey Wheels Office', '08/03/2019 16:07', '2', '2019-03-07 10:39:10', '1', 'saikatakam999@gmail.com', '9391090908', 'SAIKRISHNA KATAKAM', '1.0', '0.0', '0.0'),
(4, 'order_C4vqCCTMdx6SPx', 'pay_C4vqt646EsTMHn', 50, 'BICYCLE', 4, 'Journey Wheels Office', '08/03/2019 20:17', '  Journey Wheels Office', '09/03/2019 20:17', '2', '2019-03-08 14:49:30', '1', 'sairamkatakam999@gmail.com', '8977770505', 'Sairamkatakam', '1.0', '0.0', '0.0'),
(5, 'order_C6KcAfzjp60MiF', 'pay_C6KcTJcpVBVgPJ', 7, 'BICYCLE', 4, 'Journey Wheels Office', '12/03/2019 09:10', '  Journey Wheels Office', '13/03/2019 09:10', '2', '2019-03-12 03:42:04', '1', 'saikatakam999@gmail.com', '9391090908', 'SAIKRISHNA KATAKAM', '1.0', '0.0', '0.0'),
(6, 'order_C830wp0vBCqVVk', 'pay_C831kacfJltwIi', 50, 'BICYCLE', 4, 'Journey Wheels Office', '16/03/2019 17:14', '  Journey Wheels Office', '31/03/2019 17:14', '2', '2019-03-16 11:47:51', '15.8', 'sairamkatakam999@gmail.com', '8977770505', 'Sairamkatakam', '15.0', '0.4', '0.4'),
(9, 'order_CT70IZTs22VuaQ', 'pay_CT71vujDLWq1yv', 628, 'BICYCLE', 4, 'Bus Stand', '09/05/2019 15:00', '  Bus Stand', '10/06/2019 00:00', '2', '2019-05-08 17:21:20', '33', 'praveen180260@gmail.com', '8187808076', 'Praveen', '31.4', '0.8', '0.8'),
(10, 'order_CgldesbSGeHTE3', 'pay_Cglmi3BPrKKTar', 7, 'Bi-Cycle', 2, 'Journey Wheels Office', '12/06/2019 11:00', '  Journey Wheels Office', '13/06/2019 11:00', '1', '2019-06-12 05:40:38', '2.2', 'saikatakam999@gmail.com', '9391090908', 'SAIKRISHNA KATAKAM', '2.0', '0.1', '0.1'),
(11, 'order_Cglp0WFAMeG9KC', 'pay_Cglpm11gdx0fTS', 7, 'Bi-Cycle', 2, 'Journey Wheels Office', '14/06/2019 11:11', '  Journey Wheels Office', '20/06/2019 11:11', '1', '2019-06-12 05:43:27', '12.6', 'saikatakam999@gmail.com', '9391090908', 'SAIKRISHNA KATAKAM', '12.0', '0.3', '0.3'),
(12, 'order_CmRsDeKMmGGSK9', 'pay_CmRt4a0cQ3N84c', 7, 'Bi-Cycle', 2, 'Journey Wheels Office', '26/06/2019 19:35', '  Journey Wheels Office', '27/06/2019 19:35', '1', '2019-06-26 14:06:38', '2.2', 'saikatakam999@gmail.com', '9391090908', 'SAIKRISHNA KATAKAM', '2.0', '0.1', '0.1'),
(13, 'order_Cp1r09wf3bnhmO', 'pay_Cp1rNXNq0cY2vi', 7, 'Bi-Cycle', 2, 'Journey Wheels Office', '03/07/2019 08:04', '  Journey Wheels Office', '04/07/2019 08:04', '1', '2019-07-03 02:36:27', '2.2', 'saikatakam999@gmail.com', '9391090908', 'SAIKRISHNA KATAKAM', '2.0', '0.1', '0.1');

-- --------------------------------------------------------

--
-- Table structure for table `cars`
--

CREATE TABLE `cars` (
  `id` int(11) NOT NULL,
  `product_title` text NOT NULL,
  `product_img` text NOT NULL,
  `price` int(11) NOT NULL,
  `price1` int(11) NOT NULL,
  `cat_id` int(11) NOT NULL,
  `location` text NOT NULL,
  `availability` text NOT NULL,
  `kmlimit` int(11) NOT NULL,
  `excess` int(11) NOT NULL
) ENGINE=MyISAM DEFAULT CHARSET=latin1;

--
-- Dumping data for table `cars`
--

INSERT INTO `cars` (`id`, `product_title`, `product_img`, `price`, `price1`, `cat_id`, `location`, `availability`, `kmlimit`, `excess`) VALUES
(5, 'Maruthi Suzuki Swift', 'car_img1.png', 1500, 2200, 1, '1', '1', 250, 4),
(6, 'Maruthi Suzuki Swift Desire', 'car_img2.png', 1600, 2300, 1, '2', '0', 250, 4),
(7, 'Tyota Innova', 'car_img3.png', 1800, 2500, 3, '1', '1', 250, 4),
(8, 'Tyota Innova Crysta', 'car_img4.png', 2000, 3500, 3, '1', '1', 250, 4),
(9, 'Maruthi Suzuki Eritiga', 'car_img5.png', 1500, 2600, 2, '1', '1', 250, 4),
(10, 'Maruthi Suzuki Swift', 'car_img1.png', 1500, 2200, 1, '2', '1', 250, 4),
(11, 'Maruthi Suzuki Swift', 'car_img1.png', 1500, 2200, 1, '3', '1', 250, 4),
(12, 'Maruthi Suzuki Swift', 'car_img1.png', 1500, 2200, 1, '4', '1', 250, 4),
(13, 'Maruthi Suzuki Swift', 'car_img1.png', 1500, 2200, 1, '5', '1', 250, 4),
(15, 'Maruthi Suzuki Swift Desire', 'car_img2.png', 1600, 2300, 1, '3', '1', 250, 4),
(16, 'Maruthi Suzuki Swift Desire', 'car_img2.png', 1600, 2300, 1, '4', '1', 250, 4),
(17, 'Maruthi Suzuki Swift Desire', 'car_img2.png', 1600, 2300, 2, '5', '1', 250, 4),
(18, 'Tyota Innova', 'car_img3.png', 1800, 2500, 3, '2', '1', 250, 4),
(19, 'Tyota Innova', 'car_img3.png', 1800, 2500, 3, '3', '1', 250, 4),
(20, 'Tyota Innova', 'car_img3.png', 1800, 2500, 3, '4', '1', 250, 4),
(21, 'Tyota Innova', 'car_img3.png', 1800, 2500, 3, '5', '1', 250, 4),
(22, 'Tyota Innova Crysta', 'car_img4.png', 2000, 3500, 3, '2', '1', 250, 4),
(23, 'Tyota Innova Crysta', 'car_img4.png', 2000, 3500, 3, '3', '1', 250, 4),
(24, 'Tyota Innova Crysta', 'car_img4.png', 2000, 3500, 3, '4', '1', 250, 4),
(25, 'Tyota Innova Crysta', 'car_img4.png', 2000, 3500, 3, '5', '1', 250, 4),
(26, 'Maruthi Suzuki Eritiga', 'car_img5.png', 1500, 2600, 3, '2', '1', 250, 4),
(27, 'Maruthi Suzuki Eritiga', 'car_img5.png', 1500, 2600, 1, '3', '1', 250, 4),
(28, 'Maruthi Suzuki Eritiga', 'car_img5.png', 1500, 2600, 1, '4', '1', 250, 4),
(29, 'Maruthi Suzuki Eritiga', 'car_img5.png', 1500, 2600, 1, '5', '1', 250, 4);

-- --------------------------------------------------------

--
-- Table structure for table `cars_orders`
--

CREATE TABLE `cars_orders` (
  `id` int(11) NOT NULL,
  `razorpay_order_id` text NOT NULL,
  `payment_id` text NOT NULL,
  `customer_id` int(11) NOT NULL,
  `vehicle_title` text NOT NULL,
  `vehicle_id` int(11) NOT NULL,
  `pick_location` text NOT NULL,
  `pick_datetime` text NOT NULL,
  `drop_location` text NOT NULL,
  `drop_datetime` text NOT NULL,
  `location` text NOT NULL,
  `order_date` timestamp NOT NULL DEFAULT current_timestamp() ON UPDATE current_timestamp(),
  `amount` text NOT NULL,
  `email` text NOT NULL,
  `contact_no` text NOT NULL,
  `name` text NOT NULL,
  `rent` text NOT NULL,
  `tax` text NOT NULL,
  `tax1` text NOT NULL
) ENGINE=MyISAM DEFAULT CHARSET=latin1;

--
-- Dumping data for table `cars_orders`
--

INSERT INTO `cars_orders` (`id`, `razorpay_order_id`, `payment_id`, `customer_id`, `vehicle_title`, `vehicle_id`, `pick_location`, `pick_datetime`, `drop_location`, `drop_datetime`, `location`, `order_date`, `amount`, `email`, `contact_no`, `name`, `rent`, `tax`, `tax1`) VALUES
(1, 'order_C3kAhwFYi4eCpX', 'pay_C3kB3Jxr0liDd2', 7, 'Maruthi Suzuki Swift Desire', 6, 'Journey Wheels Office', '05/03/2019 20:05', '  Journey Wheels Office', '06/03/2019 20:05', '2', '2019-09-13 06:37:16', '24.15', 'saikatakam999@gmail.com', '9391090908', 'SAIKRISHNA KATAKAM', '2300.0', '57.5', '0.0'),
(2, 'order_C4KY3W8XxuhOGv', 'pay_C4KYOJeEh6Y16e', 7, 'Maruthi Suzuki Swift Desire', 14, 'Journey Wheels Office', '07/03/2019 07:48', '  Journey Wheels Office', '07/03/2019 19:48', '2', '2019-09-13 06:37:16', '1', 'saikatakam999@gmail.com', '9391090908', 'SAIKRISHNA KATAKAM', '1.0', '0.0', '0.0'),
(3, 'order_C4vyGJ6oWT1BKN', 'pay_C4vydQ9KJLsvsj', 50, 'Maruthi Suzuki Swift Desire', 6, 'Journey Wheels Office', '08/03/2019 20:24', '  Journey Wheels Office', '09/03/2019 08:24', '2', '2019-09-13 06:37:16', '1', 'sairamkatakam999@gmail.com', '8977770505', 'Sairamkatakam', '1.0', '0.0', '0.0'),
(4, 'order_CB8ZUpcsbDB004', 'pay_CB8a5cadNbvzNb', 50, 'Maruthi Suzuki Swift Desire', 14, 'Journey Wheels Office', '24/03/2019 12:39', '  Journey Wheels Office', '25/03/2019 00:39', '2', '2019-09-13 06:37:16', '1', 'sairamkatakam999@gmail.com', '8977770505', 'Sairamkatakam', '1.0', '0.0', ''),
(5, 'order_Cgw5mNqpULoHt6', 'pay_Cgw6qWFkUzDsrz', 7, 'Maruthi Suzuki Swift Desire', 14, 'Journey Wheels Office', '12/06/2019 21:14', '  Journey Wheels Office', '13/06/2019 09:14', '2', '2019-09-13 06:37:16', '9.4', 'saikatakam999@gmail.com', '9391090908', 'SAIKRISHNA KATAKAM', '9.0', '0.2', '');

-- --------------------------------------------------------

--
-- Table structure for table `categories`
--

CREATE TABLE `categories` (
  `cat_id` int(11) NOT NULL,
  `cat_title` text NOT NULL
) ENGINE=MyISAM DEFAULT CHARSET=latin1;

--
-- Dumping data for table `categories`
--

INSERT INTO `categories` (`cat_id`, `cat_title`) VALUES
(1, 'Regular'),
(2, 'Pro'),
(3, 'Advanced');

-- --------------------------------------------------------

--
-- Table structure for table `coupons`
--

CREATE TABLE `coupons` (
  `id` int(11) NOT NULL,
  `coupon` text NOT NULL,
  `offer` int(11) NOT NULL
) ENGINE=MyISAM DEFAULT CHARSET=latin1;

--
-- Dumping data for table `coupons`
--

INSERT INTO `coupons` (`id`, `coupon`, `offer`) VALUES
(33, 'JW20', 20),
(12, 'JWNEW', 10),
(34, 'Jwmonthly', 10),
(28, 'Jw15', 15),
(29, 'JWGET15', 15),
(30, 'jwget20', 20),
(38, 'JWGET18', 18),
(48, 'vgs', 50),
(49, 'MAHE', 80);

-- --------------------------------------------------------

--
-- Table structure for table `customers_orders`
--

CREATE TABLE `customers_orders` (
  `id` int(11) NOT NULL,
  `razorpay_order_id` text NOT NULL,
  `payment_id` text NOT NULL,
  `customer_id` int(11) NOT NULL,
  `vehicle_title` text NOT NULL,
  `vehicle_id` int(11) NOT NULL,
  `pick_location` text NOT NULL,
  `pick_datetime` text NOT NULL,
  `drop_location` text NOT NULL,
  `drop_datetime` text NOT NULL,
  `location` text NOT NULL,
  `order_date` timestamp NOT NULL DEFAULT current_timestamp() ON UPDATE current_timestamp(),
  `amount` text NOT NULL,
  `email` text NOT NULL,
  `contact_no` text NOT NULL,
  `name` text NOT NULL,
  `rent` text NOT NULL,
  `tax` text NOT NULL,
  `tax1` text NOT NULL,
  `hel` int(11) NOT NULL
) ENGINE=MyISAM DEFAULT CHARSET=latin1;

--
-- Dumping data for table `customers_orders`
--

INSERT INTO `customers_orders` (`id`, `razorpay_order_id`, `payment_id`, `customer_id`, `vehicle_title`, `vehicle_id`, `pick_location`, `pick_datetime`, `drop_location`, `drop_datetime`, `location`, `order_date`, `amount`, `email`, `contact_no`, `name`, `rent`, `tax`, `tax1`, `hel`) VALUES
(53, 'order_BrTCQf68jyJ74z', 'pay_BrTGAtnGvVNCuP', 89, 'Honda active', 8, 'Journey Wheels Office', '03/02/2019 07:45', '  Journey Wheels Office', '04/02/2019 07:45', '2', '2019-02-02 14:25:03', '399', 'mahendrabalu998@gmail.com', '6304041389', 'Balumahendra', '380.0', '9.5', '9.5', 1),
(52, 'order_BrSM0h8mhg0KZJ', 'pay_BrSPEaElmaJ1D5', 88, 'Royal enfield thunderbird x350', 21, 'Journey Wheels Office', '02/02/2019 18:59', '  Journey Wheels Office', '03/02/2019 18:59', '2', '2019-02-02 13:35:21', '1470', 'abhinavrocky99@gmail.com', '9989191434', 'Abhinav Sai', '1400.0', '35.0', '35.0', 1),
(51, 'order_BrRbA9c46WIQpG', 'pay_BrRdORpi5YV1Sb', 86, 'Honda active', 8, 'Journey Wheels Office', '02/02/2019 18:14', '  Journey Wheels Office', '03/02/2019 18:14', '2', '2019-02-02 12:53:10', '399', 'Pavankumr24409@gmail.com', '7095024409', 'Challa Pavankumar', '380.0', '9.5', '9.5', 1),
(50, 'order_BrRNqdOQg1tJmT', 'pay_BrRQQdO2qFx8k7', 7, 'Honda active', 8, 'Journey Wheels Office', '02/02/2019 18:02', '  Journey Wheels Office', '03/02/2019 23:03', '2', '2019-02-02 12:37:50', '482.4', 'saikatakam999@gmail.com', '9391090908', 'SAIKRISHNA KATAKAM', '459.4', '11.5', '11.5', 1),
(49, 'order_BrLP2ukdaQ3avx', 'pay_BrLROyvulAlhcq', 84, 'Honda active', 35, 'Pick-Up Vijayawada Location', '02/02/2019 14:00', '  Drop-Off Vijayawada Location', '04/02/2019 14:00', '1', '2019-02-02 06:45:46', '903', 'kdani.p@gmail.com', '9916348842', 'Daniel prakash', '860.0', '21.5', '21.5', 1),
(8, 'order_BbAXepHCMCHHBN', 'pay_BbAZnpy5huzKcA', 25, 'Yamaha Rayzr', 37, 'Vijayawada Address1', '2018-12-23', '  Vijayawada Address1', '2018-12-24', '1', '2018-12-23 09:43:42', '420', 'kh.deepaksingh@gmail.com', '8149658446', 'Deepak Singh', '', '', '', 0),
(9, 'order_BbST8rf9Olln8k', 'pay_BbSUxTUrFEiUtd', 27, 'Sample', 33, 'Pick-Up Nellore Location', '2018-12-24', '  Drop-Off Nellore Location', '2018-12-25', '3', '2018-12-24 03:15:55', '1', 'jagadeeshwarreddy999@gmail.com', '8885460999', 'Jagadeeshwarreddy', '', '', '', 0),
(10, 'order_BbSW1DbwJpXYUt', 'pay_BbSaL5iZfaE74L', 27, 'Sample', 33, 'Pick-Up Nellore Location', '2018-12-24', '  Drop-Off Nellore Location', '2018-12-25', '3', '2018-12-24 03:23:38', '1', 'jagadeeshwarreddy999@gmail.com', '8885460999', 'Jagadeeshwarreddy', '', '', '', 0),
(46, 'order_BqTnX1KvB8VPzL', 'pay_BqTo04m7Y8jvwi', 77, 'Jupiter classic', 36, 'Railway Station', '31/01/2019 10:15', '  Railway Station', '31/01/2019 22:45', '1', '2019-01-31 02:18:52', '235.2', 'surendrachitteti@gmail.com', '9030798889', 'CHITTETI SURENDRA BABU', '224.0', '5.6', '5.6', 1),
(13, 'order_Bc0FC9jpMpoz4J', 'pay_Bc0Hx9yrCigHLV', 7, 'Sample', 33, 'Nellore Address1', '2018-12-26', '  Nellore Address1', '2018-12-28', '3', '2018-12-25 12:18:56', '2.2', 'saikatakam999@gmail.com', '9391090908', 'saikrishna katakam', '', '', '', 0),
(14, 'order_Bc0FC9jpMpoz4J', 'pay_Bc0Hx9yrCigHLV', 7, 'Sample', 33, 'Nellore Address1', '2018-12-26', '  Nellore Address1', '2018-12-28', '3', '2018-12-25 12:19:08', '2.2', 'saikatakam999@gmail.com', '9391090908', 'saikrishna katakam', '', '', '', 0),
(48, 'order_Br3WeAO4rukKDp', 'pay_Br3d0tbR1jrp52', 83, 'Jupiter classic', 10, 'Journey Wheels Office', '02/02/2019 17:00', '  Journey Wheels Office', '03/02/2019 17:00', '2', '2019-02-01 13:20:21', '399', 'suryareddymuthaluru@gmail.com', '8095853851', 'Lingareddy chaithanya Kumar reddy', '380.0', '9.5', '9.5', 1),
(16, 'order_Bhc2x8NEMUw9fj', 'pay_Bhc3HZ8G6AMGVV', 7, 'Sample', 33, 'Nellore Address1', '09/01/2019 10:00', '  Nellore Address1', '10/01/2019 10:00', '3', '2019-01-08 16:30:23', '1', 'saikatakam999@gmail.com', '9391090908', 'saikrishna katakam', '', '', '', 0),
(17, 'order_Bhc2x8NEMUw9fj', 'pay_Bhc3HZ8G6AMGVV', 7, 'Sample', 33, 'Nellore Address1', '09/01/2019 10:00', '  Nellore Address1', '10/01/2019 10:00', '3', '2019-01-08 16:30:44', '1', 'saikatakam999@gmail.com', '9391090908', 'saikrishna katakam', '', '', '', 0),
(47, 'order_Br030YV1KcGTpL', 'pay_Br04ieWwCRhfWX', 82, 'Yamaha rayz street rally', 12, 'Journey Wheels Office', '01/03/2019 18:12', ' Journey Wheels Office', '03/03/2019 18:12', '2', '2019-02-01 09:51:47', '840', 'pattabiraman07@yahoo.co.in', '2999545455', 'G Pattabiraman', '800.0', '20.0', '20.0', 1),
(20, 'order_BlU4wHM2Dbl7Up', 'pay_BlU5sP74SQsSF1', 7, 'Sample', 33, 'Journey Wheels Office', '19/01/2019 16:47', '  Journey Wheels Office', '20/01/2019 16:47', '3', '2019-01-18 11:21:01', '1', 'saikatakam999@gmail.com', '9391090908', 'SAIKRISHNA KATAKAM', '1.0', '0.0', '0.0', 1),
(21, 'order_BlmzfBy5sB2BIC', 'pay_BlmzrSLUHEWXhh', 4, 'Sample', 33, 'Journey Wheels Office', '19/01/2019 11:07', '  Journey Wheels Office', '20/01/2019 11:07', '3', '2019-01-19 05:49:19', '1', 'sumithravgs@gmail.com', '8374211970', 'Vgs', '1.0', '0.0', '0.0', 1),
(22, 'order_BmmZPMBOf1kRmo', 'pay_BmmaP46vEiwQzT', 48, 'Jupiter classic', 38, 'Journey Wheels Office', '22/01/2019 13:30', '  Journey Wheels Office', '23/01/2019 13:30', '1', '2019-01-21 18:04:13', '451.6', 'praggu43@gmail.com', '9652328792', 'Pragath Kathula', '430.0', '10.8', '10.8', 1),
(23, 'order_Bmx6NJddLcl2Ny', 'pay_Bmx7Mv9h7ygOdC', 7, 'Sample', 33, 'Journey Wheels Office', '23/01/2019 09:00', '  Journey Wheels Office', '24/01/2019 09:00', '3', '2019-01-22 04:22:27', '1', 'saikatakam999@gmail.com', '9391090908', 'SAIKRISHNA KATAKAM', '1.0', '0.0', '0.0', 1),
(24, 'order_BmyvYt8tlrqcTO', 'pay_BmyvsCjfkR15bM', 7, 'Sample', 33, 'Journey Wheels Office', '25/01/2019 11:36', '  Journey Wheels Office', '26/01/2019 11:36', '3', '2019-01-22 06:08:37', '1', 'saikatakam999@gmail.com', '9391090908', 'SAIKRISHNA KATAKAM', '1.0', '0.0', '0.0', 1),
(25, 'order_BmzPmuTlBn5oFa', 'pay_BmzRceqOdekB1s', 41, 'Sample', 33, 'Railway Station', '26/02/2019 12:05', '  Railway Station', '27/02/2019 12:05', '3', '2019-01-22 06:38:43', '1', 'nedigenti@gmail.com', '9912377427', 'Ranjit', '1.0', '0.0', '0.0', 1),
(26, 'order_BmzZySReXYflrZ', 'pay_BmzbfsrzF8lHP2', 50, 'Sample', 33, 'Journey Wheels Office', '30/01/2019 00:02', '  Journey Wheels Office', '31/01/2019 00:02', '3', '2019-01-22 06:48:23', '1', 'sairamkatakam999@gmail.com', '8977770505', 'Sairamkatakam', '1.0', '0.0', '0.0', 1),
(27, 'order_Bn4SqqrNl40bpA', 'pay_Bn4T8pXr9EhU8B', 4, 'Sample', 33, 'Journey Wheels Office', '22/01/2019 17:01', '  Railway Station', '23/01/2019 17:01', '3', '2019-01-22 11:33:39', '1', 'sumithravgs@gmail.com', '8374211970', 'Vgs', '1.0', '0.0', '0.0', 1),
(28, 'order_BnKdpZSOrInoUc', 'pay_BnKf8tyuugpIVW', 52, 'Jupiter classic', 13, 'Journey Wheels Office', '23/01/2019 09:00', '  Journey Wheels Office', '24/01/2019 09:00', '2', '2019-01-23 03:24:10', '399', 'akashvarma2817@gmail.com', '8125513418', 'K SUNMUk Akash varma', '380.0', '9.5', '9.5', 1),
(29, 'order_BnoVyKsMAYx9I9', 'pay_BnoXecBxpwRCkA', 54, 'Sample', 33, 'Journey Wheels Office', '24/01/2019 14:03', '  Railway Station', '25/01/2019 14:03', '3', '2019-01-24 08:37:44', '1', 'manikantaprasad123@gmail.com', '9030537173', 'MANIKANTAPRASAD', '1.0', '0.0', '0.0', 1),
(30, 'order_BnsdBJ6omLEk8Y', 'pay_Bnsdq4rZumV51J', 56, 'Sample', 33, 'Journey Wheels Office', '25/01/2019 18:30', '  Journey Wheels Office', '26/01/2019 18:31', '3', '2019-01-24 12:38:37', '1', 'devireddy.mallikarjun@gmail.com', '8886100028', 'arjun', '1.0', '0.0', '0.0', 1),
(31, 'order_BnsdBJ6omLEk8Y', 'pay_Bnsdq4rZumV51J', 56, 'Sample', 33, 'Journey Wheels Office', '25/01/2019 18:30', '  Journey Wheels Office', '26/01/2019 18:31', '3', '2019-01-24 12:39:26', '1', 'devireddy.mallikarjun@gmail.com', '8886100028', 'arjun', '1.0', '0.0', '0.0', 1),
(32, 'order_Bo7vnm6qPzVP06', 'pay_Bo80K3GB3k7bTB', 57, 'Bajaj Pulsar 150cc', 43, 'Bus Stand', '25/01/2019 09:30', ' Bus Stand', '28/01/2019 21:00', '1', '2019-01-25 03:40:00', '2374.5', 'srirajdodda@gmail.com', '9121997072', 'Sriraj Dodda', '2261.5', '56.5', '56.5', 1),
(33, 'order_Bo7vnm6qPzVP06', 'pay_Bo80K3GB3k7bTB', 57, 'Bajaj Pulsar 150cc', 43, 'Bus Stand', '25/01/2019 09:30', ' Bus Stand', '28/01/2019 21:00', '1', '2019-01-25 03:42:15', '2374.5', 'srirajdodda@gmail.com', '9121997072', 'Sriraj Dodda', '2261.5', '56.5', '56.5', 1),
(34, 'order_BoK8LJ5ItsnWgt', 'pay_BoK9atbzUosrjE', 61, 'Royal enfield thunderbird x350', 21, 'Journey Wheels Office', '25/01/2019 21:58', '  Journey Wheels Office', '26/01/2019 20:58', '2', '2019-01-25 15:33:28', '1408.7', 'omtheleo@gmail.com', '9666266267', 'Ompraksh', '1341.7', '33.5', '33.5', 1),
(35, 'order_Bou0EX86ZiXRPi', 'pay_Bou22zK9zGz0Fs', 50, 'Jupiter', 9, 'Railway Station', '27/01/2019 10:00', '  Railway Station', '28/01/2019 00:00', '2', '2019-01-27 02:39:10', '232.7', 'sairamkatakam999@gmail.com', '8977770505', 'Sairamkatakam', '221.7', '5.5', '5.5', 1),
(36, 'order_Bou6drW4VZO70G', 'pay_Bou7WpXEd6PMi3', 7, 'Sample', 33, 'Journey Wheels Office', '28/01/2019 10:01', '  Journey Wheels Office', '29/01/2019 10:01', '3', '2019-01-27 02:44:13', '1', 'saikatakam999@gmail.com', '9391090908', 'SAIKRISHNA KATAKAM', '1.0', '0.0', '0.0', 1),
(37, 'order_BpIJ8t6PCIv1Qc', 'pay_BpILV6sta2Uywp', 50, 'Jupiter', 9, 'Bus Stand', '28/01/2019 08:00', '  Railway Station', '28/01/2019 13:00', '2', '2019-01-28 02:26:31', '166.3', 'sairamkatakam999@gmail.com', '8977770505', 'Sairamkatakam', '158.3', '4.0', '4.0', 1),
(38, 'order_BpQmK9PimDP4gy', 'pay_BpQmaOWXYTcFNi', 4, 'Sample', 33, 'Pick-Up Nellore Location', '28/01/2019 16:09', '  Drop-Off Nellore Location', '29/01/2019 16:09', '3', '2019-01-28 10:41:51', '1', 'sumithravgs@gmail.com', '8374211970', 'Vgs', '1.0', '0.0', '0.0', 1),
(39, 'order_BpSYFnQxGISiat', 'pay_BpSbLELnlaUJhQ', 7, 'Sample', 33, 'Journey Wheels Office', '28/01/2019 17:53', '  Journey Wheels Office', '29/01/2019 17:53', '3', '2019-01-28 12:28:08', '1', 'saikatakam999@gmail.com', '9391090908', 'SAIKRISHNA KATAKAM', '1.0', '0.0', '0.0', 1),
(40, 'order_BpTBQsIaw6ne33', 'pay_BpTKOSobz1ZCVb', 7, 'Sample', 33, 'Journey Wheels Office', '28/01/2019 18:30', '  Bus Stand', '29/01/2019 18:30', '3', '2019-01-28 13:11:00', '1', 'saikatakam999@gmail.com', '9391090908', 'SAIKRISHNA KATAKAM', '1.0', '0.0', '0.0', 1),
(41, 'order_BpX4sR5MPN6kHf', 'pay_BpX9HRJUJOk33w', 7, 'Sample', 33, 'Journey Wheels Office', '28/01/2019 21:32', '  Journey Wheels Office', '29/01/2019 21:32', '3', '2019-01-28 16:55:14', '1', 'saikatakam999@gmail.com', '9391090908', 'SAIKRISHNA KATAKAM', '1.0', '0.0', '0.0', 1),
(42, 'order_BpXDJm4azTMjpK', 'pay_BpXEHDL6G9jA3Q', 7, 'Sample', 33, 'Journey Wheels Office', '28/01/2019 22:26', '  Journey Wheels Office', '29/01/2019 22:26', '3', '2019-01-28 16:59:34', '1', 'saikatakam999@gmail.com', '9391090908', 'SAIKRISHNA KATAKAM', '1.0', '0.0', '0.0', 1),
(43, 'order_BpoRv6qyfwlbZC', 'pay_BpoTmlkcO6FaS3', 50, 'Yamaha FZ25', 14, 'Journey Wheels Office', '29/01/2019 17:31', '  Journey Wheels Office', '30/01/2019 15:18', '2', '2019-01-29 09:54:40', '1003', 'sairamkatakam999@gmail.com', '8977770505', 'Sairamkatakam', '907.6', '22.7', '22.7', 1),
(44, 'order_BppO37Ljv48SmS', 'pay_BppOxXzziLwITx', 7, 'Sample', 33, 'Journey Wheels Office', '29/01/2019 16:14', '  Journey Wheels Office', '30/01/2019 16:14', '3', '2019-01-29 10:46:23', '1', 'saikatakam999@gmail.com', '9391090908', 'SAIKRISHNA KATAKAM', '1.0', '0.0', '0.0', 1),
(45, 'order_Bq9VmD1Fk172zv', 'pay_Bq9XqcwE6RR5g0', 55, 'Sample', 33, 'Bus Stand', '31/01/2019 11:53', ' Journey Wheels Office', '01/02/2019 11:53', '3', '2019-01-30 06:28:47', '1', 'pchakravarthy16@gmail.com', '9440709885', 'PRATHAP CHAKRAVARTHY', '1.0', '0.0', '0.0', 1),
(54, 'order_BrUn369X5Jgivn', 'pay_BrUngQKaRoQ4gJ', 90, 'Bajaj Pulsar 150cc', 43, 'Bus Stand', '02/02/2019 21:30', '  Bus Stand', '03/02/2019 21:30', '1', '2019-02-02 15:56:15', '682.6', 'ravikiran4challari@gmail.com', '9398579677', 'Ch Ravi kiran', '650.0', '16.3', '16.3', 1),
(55, 'order_BrVY0VkUSrDfcI', 'pay_BrVYmcLqPGIv4B', 91, 'Sample', 33, 'Bus Stand', '03/02/2019 09:00', '  Bus Stand', '04/02/2019 09:00', '3', '2019-02-02 16:41:37', '1', 'ssaiesh539@gmail.com', '7330647849', 'Sai Mahesh', '1.0', '0.0', '0.0', 1),
(56, 'order_BrhPiMkVbMfPf4', 'pay_BrhUAKJ6JHXZeR', 50, 'Aprilia 150cc', 20, 'Railway Station', '03/02/2019 09:43', '  Journey Wheels Office', '04/02/2019 09:43', '2', '2019-02-03 04:19:44', '451.6', 'sairamkatakam999@gmail.com', '8977770505', 'Sairamkatakam', '430.0', '10.8', '10.8', 1),
(57, 'order_BriaSQgSPWLLpc', 'pay_BridgEXDbe26tu', 0, 'Jupiter classic', 36, 'Bus Stand', '04/02/2019 10:00', '  Bus Stand', '04/02/2019 18:30', '1', '2019-02-03 05:27:38', '319.8', '', '', '', '304.6', '7.6', '7.6', 1),
(58, 'order_BrnOBK27aWFGFI', 'pay_BrnS46P1I4MZww', 94, 'Jupiter classic', 36, 'Pick-Up Vijayawada Location', '04/02/2019 07:00', '  Drop-Off Vijayawada Location', '04/02/2019 19:00', '1', '2019-02-03 10:11:07', '225.8', 'adithyac164@gmail.com', '8790643543', 'Nukavarapu Aditya', '215.0', '5.4', '5.4', 1),
(59, 'order_BsH0u44nEp3NRH', 'pay_BsH3loNlPzMWzL', 7, 'Sample', 33, 'Journey Wheels Office', '04/02/2019 20:33', '  Journey Wheels Office', '05/02/2019 20:33', '3', '2019-02-04 15:07:53', '1', 'saikatakam999@gmail.com', '9391090908', 'SAIKRISHNA KATAKAM', '1.0', '0.0', '0.0', 1),
(60, 'order_BsR1zhBYwXcmgd', 'pay_BsR3XcX4CFM4hR', 77, 'Jupiter classic', 38, 'Railway Station', '05/02/2019 09:30', '  Railway Station', '05/02/2019 22:45', '1', '2019-02-05 00:54:59', '249.2', 'surendrachitteti@gmail.com', '9030798889', 'CHITTETI SURENDRA BABU', '237.4', '5.9', '5.9', 1),
(61, 'order_BsiiWKYKDxWP8b', 'pay_BsikCXDvMDv9Ix', 97, 'Aprilia 150cc ', 7, 'Bus Stand', '06/02/2019 06:45', '  Bus Stand', '06/02/2019 18:45', '2', '2019-02-05 18:12:57', '225.8', 'avikas93399@gmail.com', '9701862676', 'Vikas Adugula', '215.0', '5.4', '5.4', 1),
(62, 'order_BstNMDrBnyuseL', 'pay_BstOFpuVjOaKM5', 99, 'Yamaha Rayzr', 37, 'Bus Stand', '06/02/2019 10:05', '  Bus Stand', '07/02/2019 10:01', '1', '2019-02-06 04:38:31', '450.2', 'kishanchandu07@gmail.com', '9980873232', 'Chandu', '428.8', '10.7', '10.7', 1),
(63, 'order_Bsxdn9GNgdCH9k', 'pay_BsxjNTXHj5NbAT', 96, 'Honda active', 35, 'Railway Station', '06/02/2019 14:25', '  Railway Station', '10/02/2019 15:00', '1', '2019-02-06 08:52:40', '1817.1', 'rohitom04@gmail.com', '8124386933', 'Rohit Omkar', '1730.5', '43.3', '43.3', 1),
(64, 'order_Bsxdn9GNgdCH9k', 'pay_BsxjNTXHj5NbAT', 96, 'Honda active', 35, 'Railway Station', '06/02/2019 14:25', '  Railway Station', '10/02/2019 15:00', '1', '2019-02-06 08:53:11', '1817.1', 'rohitom04@gmail.com', '8124386933', 'Rohit Omkar', '1730.5', '43.3', '43.3', 1),
(65, 'order_BtHPSgtIW9hXTH', 'pay_BtHRzdcHXcrbUh', 103, 'Honda active', 35, 'Pick-Up Vijayawada Location', '07/02/2019 10:18', '  Drop-Off Vijayawada Location', '07/02/2019 18:30', '1', '2019-02-07 04:12:17', '308.4', 'nagaraj.pallipattu@gmail.com', '8143781335', 'Nagaraj', '293.8', '7.3', '7.3', 1),
(66, 'order_BtIILgiYsM9Dyi', 'pay_BtIJHPk3OC2pSx', 105, 'Honda active', 35, 'Pick-Up Vijayawada Location', '05/02/2019 10:26', '  Drop-Off Vijayawada Location', '09/02/2019 10:26', '1', '2019-02-07 05:00:02', '1806', 'ashwanth.m@leanagri.com', '8056105066', 'Ashwanth Monian', '1720.0', '43.0', '43.0', 1),
(67, 'order_BtKxF7ozPEzE8e', 'pay_BtL06QM9XJB7NG', 106, 'Yamaha Rayzr', 37, 'Bus Stand', '07/02/2019 14:02', '  Bus Stand', '09/02/2019 20:03', '1', '2019-02-07 07:38:46', '1016.2', 'harishkumar781@gmail.com', '9502779109', 'Harish', '967.8', '24.2', '24.2', 1),
(68, 'order_BtNqGKLd1VgsZ3', 'pay_BtNrbacSDuKzMf', 108, 'Sample', 33, 'Journey Wheels Office', '07/02/2019 15:51', '  Journey Wheels Office', '08/02/2019 15:51', '3', '2019-02-07 10:26:15', '1', 'sushmavgs24@gmail.com', '7993448817', 'Sushma', '1.0', '0.0', '0.0', 1),
(69, 'order_BthgOqrH2rOYSs', 'pay_Bthhb4qhb1aqnb', 110, 'Honda active', 35, '', '08/02/2019 11:17', '  Journey Wheels Office', '09/02/2019 11:17', '1', '2019-02-08 05:50:32', '451.6', 'vickydavuluri@gmail.com', '9505812055', 'NaNi Davuluri', '430.0', '10.8', '10.8', 1),
(70, 'order_Bu326NTzI60wE3', 'pay_Bu37GV8qcBhAWc', 115, 'Yamaha Rayzr', 37, 'Railway Station', '09/02/2019 09:10', '  Railway Station', '10/02/2019 08:11', '1', '2019-02-09 02:47:28', '451.6', 'ydv.nikhil10@gmail.com', '8686086119', 'Nikhil Yadav', '430.0', '10.8', '10.8', 1),
(71, 'order_Bu38REf8LUB0R6', 'pay_Bu39Wjtnx7r7bf', 113, 'Jupiter classic', 36, 'Journey Wheels Office', '09/02/2019 08:16', '  Journey Wheels Office', '11/02/2019 08:16', '1', '2019-02-09 02:49:48', '903', 'bhushan.aaluru@gmail.com', '09849971664', 'Bhushan Aaluru', '860.0', '21.5', '21.5', 1),
(72, 'order_Bu5IbnfXctLUBg', 'pay_Bu5JUCTMbxLiMB', 116, 'Royal enfield classic 350', 18, 'Journey Wheels Office', '09/02/2019 10:22', '  Journey Wheels Office', '10/02/2019 10:22', '2', '2019-02-09 04:56:13', '1260', 'santhoshsonu38@gmail.com', '8897757794', 'Santhosh', '1200.0', '30.0', '30.0', 1),
(73, 'order_Bu7F8pwBwbwZxW', 'pay_Bu7GLZILwcL0kr', 117, 'Honda active', 8, 'Journey Wheels Office', '09/02/2019 12:18', '  Journey Wheels Office', '10/02/2019 12:18', '2', '2019-02-09 06:50:45', '399', 'sasi.pamugari0308@gmail.com', '8179452349', 'Sasi', '380.0', '9.5', '9.5', 1),
(74, 'order_Bu8e4kSl3cTJ3W', 'pay_Bu8exiEqq50Ftn', 112, 'Honda active', 8, 'Bus Stand', '09/02/2019 14:30', '  Bus Stand', '10/02/2019 14:30', '2', '2019-02-09 08:12:42', '399', 'cm.karthick@gmail.com', '9949610966', 'OMPRAKASH', '380.0', '9.5', '9.5', 1),
(75, 'order_BucRWHZIZHVt8O', 'pay_BucSw21PTrW49f', 126, 'Honda active', 35, 'Journey Wheels Office', '11/02/2019 06:31', '  Journey Wheels Office', '14/02/2019 21:31', '1', '2019-02-10 13:22:13', '1806', 'saiakhilab1996@gmail.com', '9573180695', 'Said akhila', '1720.0', '43.0', '43.0', 1),
(76, 'order_BuuMO5HDwCDI7r', 'pay_BuuO3E7Die5ZG5', 65, 'Honda active', 35, 'Journey Wheels Office', '11/02/2019 12:23', '  Journey Wheels Office', '16/02/2019 12:23', '1', '2019-02-11 06:54:17', '2257.6', 'ashokkopparapu999@gmail.com', '8125474799', 'Ashok', '2150.0', '53.8', '53.8', 1),
(77, 'order_Buug7mkEKWxg0E', 'pay_BuuhBSCM8tSGql', 131, 'Honda active', 35, 'Railway Station', '11/02/2019 14:30', '  Railway Station', '11/02/2019 21:02', '1', '2019-02-11 07:13:10', '294.9', 'sunkavilli.ravikiran@gmail.com', '8106943313', 'ravi kiran', '280.9', '7.0', '7.0', 1),
(78, 'order_Buv197BMum2NQ0', 'pay_Buv2R94WFjdzzP', 105, 'Honda active', 35, 'Bus Stand', '10/02/2019 12:55', '  Bus Stand', '18/02/2019 12:55', '1', '2019-02-11 07:32:11', '3612', 'ashwanth.m@leanagri.com', '8056105066', 'Ashwanth Monian', '3440.0', '86.0', '86.0', 1),
(79, 'order_Buvbj7utdVFFxL', 'pay_BuvdnDRyGRt6mH', 132, 'Honda active', 35, '', '11/02/2019 14:59', '  Journey Wheels Office', '14/02/2019 06:30', '1', '2019-02-11 08:08:25', '1354.6', 'prashantgrncpl@gmail.com', '9441677616', 'Y Prsant Kumar', '1290.0', '32.3', '32.3', 1),
(80, 'order_Bv1eabBn5fiL6S', 'pay_Bv1gn035uSYDuZ', 133, 'Honda active', 8, 'Railway Station', '15/02/2019 07:00', '  Railway Station', '17/02/2019 17:00', '2', '2019-02-11 14:03:40', '1356.6', 'kspvarma3@gmail.com', '943133213', 'Varma', '1292.0', '32.3', '32.3', 1),
(81, 'order_BvG9l8Tn9ASY0E', 'pay_BvGAMkAcTQynjG', 109, 'TVS Apache', 42, 'Railway Station', '13/02/2019 09:45', '  Bus Stand', '13/02/2019 19:01', '1', '2019-02-12 04:13:06', '681.1', 'balusasidharreddy@live.com', '8688126973', 'Sasidhar Reddy Vayyeti', '648.7', '16.2', '16.2', 1),
(82, 'order_BvHitLu03CC0BO', 'pay_BvHm4hudcse6bU', 135, 'Honda active', 8, 'Journey Wheels Office', '12/02/2019 11:09', '  Journey Wheels Office', '12/02/2019 21:09', '2', '2019-02-12 05:46:42', '399', '9000naga@gmail.com', '9121025482', 'Nagendra reddy Sirigiri', '380.0', '9.5', '9.5', 1),
(83, 'order_BvKggRA9JIvHE8', 'pay_BvKhojRMHoMOfD', 137, 'Honda active', 35, 'Bus Stand', '12/02/2019 14:00', '  Bus Stand', '13/02/2019 14:00', '1', '2019-02-12 08:41:35', '451.6', 'dinesh.mj00@gmail.com', '9542496757', 'Durga dinesh', '430.0', '10.8', '10.8', 1),
(84, 'order_BvNBy18QLreQh8', 'pay_BvNFiwHNmuehvG', 138, 'Bajaj Pulsar 150cc', 43, 'Bus Stand', '13/02/2019 08:00', '  Bus Stand', '13/02/2019 20:00', '1', '2019-02-12 11:08:16', '682.6', 'ravitejagollamandala@gmail.com', '9676364487', 'Raviteja', '650.0', '16.3', '16.3', 1),
(85, 'order_BvksBtrbKvQOEY', 'pay_BvkvA3FamdqHr3', 140, 'Yamaha Rayzr', 11, 'Journey Wheels Office', '13/02/2019 15:50', '  Journey Wheels Office', '13/02/2019 21:00', '2', '2019-02-13 10:17:34', '206.1', 'milindpvrao@gmail.com', '9739179699', 'Milind', '196.3', '4.9', '4.9', 1),
(86, 'order_BvybwJSgLywi7R', 'pay_Bvyeh0kdcdhi2A', 142, 'Yamaha FZ 150', 39, 'Bus Stand', '14/02/2019 05:08', '  Bus Stand', '14/02/2019 23:02', '1', '2019-02-13 23:44:47', '787.6', 'chramireddy135@gmail.com', '7780257562', 'Challa Venkata ramireddy', '750.0', '18.8', '18.8', 1),
(87, 'order_Bw3uwOnaz1y4AV', 'pay_Bw3vD8tg3wC8My', 145, 'Suziki Access 125', 62, 'Journey Wheels Office', '14/02/2019 10:30', '  Journey Wheels Office', '14/02/2019 23:57', '2', '2019-02-14 04:52:48', '441', 'sreetharkv@gmail.com', '8121905343', 'Sreedhar kv', '420.0', '10.5', '10.5', 1),
(88, 'order_BwDbUNZ2Jtq4tM', 'pay_BwDcLqMrrQQDok', 147, 'TVS Apache', 42, 'Railway Station', '16/02/2019 08:00', '  Railway Station', '17/02/2019 08:00', '1', '2019-02-14 14:21:57', '735', 'chrao9849@gmail.com', '9849466043', 'Chebroluvijayasrinivasarao', '700.0', '17.5', '17.5', 1),
(89, 'order_BwSVHgZAUFHZ1o', 'pay_BwSXFH2LJ0aN86', 152, 'Jupiter classic', 38, 'Journey Wheels Office', '15/02/2019 10:30', '  Journey Wheels Office', '15/02/2019 16:30', '1', '2019-02-15 04:57:22', '271', 'kumarlsn@yahoo.com', '9848442293', 'L S NKUMAR', '258.0', '6.5', '6.5', 1),
(90, 'order_BwtNI7WIFERvZL', 'pay_BwtPxu5QFmxNjj', 153, 'TVS Apache', 42, 'Bus Stand', '16/02/2019 16:00', '  Bus Stand', '17/02/2019 17:00', '1', '2019-02-16 07:14:37', '808.6', 'chaitanyakillada9@gmail.com', '7287812529', 'Chaitanya', '770.0', '19.3', '19.3', 1),
(91, 'order_BxF4tx3khRO5IL', 'pay_BxF7cJtj2Tyjfo', 100, 'Honda active', 8, 'Journey Wheels Office', '18/02/2019 10:15', '  Journey Wheels Office', '20/02/2019 10:15', '2', '2019-02-17 04:28:34', '798', 'ranbuezhil@gmail.com', '9962104745', 'Anbuezhil', '760.0', '19.0', '19.0', 1),
(92, 'order_BxGuH7X7kcoPVT', 'pay_BxGugnsFSyGLuM', 50, 'Yamaha Rayzr', 11, 'Journey Wheels Office', '17/02/2019 11:42', '  Journey Wheels Office', '21/02/2019 11:42', '2', '2019-02-17 06:13:25', '1596', 'sairamkatakam999@gmail.com', '8977770505', 'Sairamkatakam', '1520.0', '38.0', '38.0', 1),
(93, 'order_BxOl6v2WJeSDff', 'pay_BxOmC8xNhazY2q', 154, 'Yamaha FZ', 47, 'Journey Wheels Office', '18/02/2019 19:20', ' Journey Wheels Office', '19/02/2019 19:20', '4', '2019-02-17 13:55:19', '682.6', 'ROHITHCRAZY999@GMAIL.COM', '9666660003', 'Rohit', '650.0', '16.3', '16.3', 1),
(94, 'order_BxPLVAkonwfQJK', 'pay_BxPMP6YQNbWDTD', 141, 'Yamaha Rayzr', 37, 'Journey Wheels Office', '18/02/2019 09:30', '  Journey Wheels Office', '20/02/2019 21:30', '1', '2019-02-17 14:29:18', '1354.6', 'kissu05@gmail.com', '8555866617', 'Kishore Rongala', '1290.0', '32.3', '32.3', 1),
(95, 'order_ByCclRxWrlr9K4', 'pay_ByCfqjZ1OHTpv8', 100, 'Honda active', 8, 'Journey Wheels Office', '20/02/2019 10:30', '  Journey Wheels Office', '21/02/2019 10:30', '2', '2019-02-19 14:44:38', '399', 'ranbuezhil@gmail.com', '9962104745', 'Anbuezhil', '380.0', '9.5', '9.5', 1),
(96, 'order_BytD7x8pHupzzg', 'pay_BytEBQNnxkmxUU', 105, 'Yamaha Rayzr', 37, 'Journey Wheels Office', '19/02/2019 13:48', '  Bus Stand', '23/02/2019 13:48', '1', '2019-02-21 08:21:09', '1806', 'ashwanth.m@leanagri.com', '8056105066', 'Ashwanth Monian', '1720.0', '43.0', '43.0', 1),
(97, 'order_ByytwXSNsgyayK', 'pay_ByyuzNlaGJzmv8', 65, 'Yamaha FZ 150', 39, 'Journey Wheels Office', '21/02/2019 19:23', '  Journey Wheels Office', '25/02/2019 19:23', '1', '2019-02-21 13:55:30', '3150', 'ashokkopparapu999@gmail.com', '8125474799', 'Ashok', '3000.0', '75.0', '75.0', 1),
(98, 'order_Byzq2Gy18oUbS3', 'pay_ByzrYOAxKyXJRW', 158, 'Yamaha FZ 150', 39, 'Journey Wheels Office', '22/02/2019 07:00', '  Journey Wheels Office', '22/02/2019 19:00', '1', '2019-02-21 14:51:44', '787.6', 'sachin.kumar768@gmail.com', '9494770412', 'Sachin Kumar', '750.0', '18.8', '18.8', 1),
(99, 'order_BzFdpqF3f5pD9Q', 'pay_BzFf2wgBGDeu4m', 163, 'Honda activa', 53, 'Vizag Address1', '22/02/2019 12:00', '  Vizag Address1', '23/02/2019 20:00', '5', '2019-02-22 06:17:49', '756', 'nishi.jntk@gmail.com', '9030543552', 'Nishanth Sai Kumar Addanki', '720.0', '18.0', '18.0', 1),
(100, 'order_BzGBrpf42yJDYN', 'pay_BzGFx0QNUNNMhm', 164, 'Yamaha Rayzr', 37, 'Bus Stand', '24/02/2019 07:30', '  Bus Stand', '24/02/2019 20:30', '1', '2019-02-22 06:55:06', '451.6', 'sinunaresh@gmail.com', '8333831470', 'Naresh Achari', '430.0', '10.8', '10.8', 1),
(101, 'order_BzNFq2WRZ78b3J', 'pay_BzNNVJ7EUgqQe5', 169, 'Vespa', 65, 'Bus Stand', '22/02/2019 21:02', ' Bus Stand', '23/02/2019 21:02', '1', '2019-02-22 13:51:07', '525', 'saksham.singh@nid.ac.in', '7036934800', 'Saksham Singh', '500.0', '12.5', '12.5', 1),
(102, 'order_BzXtj28dnceEJ1', 'pay_BzXy7AORHt1f2O', 171, 'Honda active', 8, 'Bus Stand', '23/02/2019 05:40', '  Bus Stand', '24/02/2019 05:40', '2', '2019-02-23 00:12:38', '399', 'harish.hari.301@gmail.com', '9966086770', 'Harish Dasari', '380.0', '9.5', '9.5', 1),
(103, 'order_BzZt80nQamkgix', 'pay_BzZvNxTXS2SN9s', 172, 'Yamaha FZ 150', 15, 'Journey Wheels Office', '23/02/2019 08:00', '  Journey Wheels Office', '26/02/2019 07:30', '2', '2019-02-23 02:07:07', '2205', 'allagapally.rahul@gmail.com', '9618977440', 'ALLEGAPALLY Rahul', '2100.0', '52.5', '52.5', 1),
(104, 'order_BzeeGM1U5bav1k', 'pay_BzefVZRnnJ9hmF', 174, 'JUPITER GRANDE', 69, 'NAD Junction', '23/02/2019 12:15', '  NAD Junction', '23/02/2019 19:00', '5', '2019-02-23 06:46:43', '301.3', 'vivekanreddy.a@gmail.com', '7013090671', 'Vivekan Reddy', '286.9', '7.2', '7.2', 1),
(105, 'order_BziFi0MDoNIOte', 'pay_BziKzqosMwKcpk', 173, 'Yamaha FZ 150', 39, 'Railway Station', '23/02/2019 16:00', '  Railway Station', '24/02/2019 17:00', '1', '2019-02-23 10:24:22', '866.2', 'rajaratnakarvuyyuru@gmail.com', '9502886315', 'V raja ratnakar', '825.0', '20.6', '20.6', 1),
(106, 'order_BzkZleVl5gQxJg', 'pay_Bzkd7I79JTcodt', 175, 'Jupiter classic', 10, 'Bus Stand', '23/02/2019 18:30', '  Bus Stand', '24/02/2019 22:00', '2', '2019-02-23 12:35:58', '538.6', 'kiran.bihana@gmail.com', '8143313235', 'Kiran', '513.0', '12.8', '12.8', 1),
(107, 'order_BzoFVRlmcj7hfc', 'pay_BzoHBf5vFsWrjI', 178, 'Honda active', 8, 'Journey Wheels Office', '23/02/2019 22:00', '  Journey Wheels Office', '24/02/2019 12:13', '2', '2019-02-23 16:09:48', '399', 'munisanchi@gmail.com', '9397979100', 'MUNEENDRASMB', '380.0', '9.5', '9.5', 1),
(108, 'order_BzoE08e2oF7mPB', 'pay_BzoICivUXR7JCH', 177, 'Honda active', 35, 'Railway Station', '23/02/2019 22:02', '  Railway Station', '25/02/2019 22:02', '1', '2019-02-23 16:10:49', '905.2', 'beingabdullah101@gmail.com', '8185878482', 'Mohammed Abdullah', '862.0', '21.6', '21.6', 1),
(109, 'order_BzoabVqY5Mg1cV', 'pay_BzodSNxnsV6pZl', 177, 'Honda active', 35, 'Railway Station', '23/02/2019 22:02', '  Railway Station', '25/02/2019 22:02', '1', '2019-02-23 16:30:50', '905.2', 'beingabdullah101@gmail.com', '8185878482', 'Mohammed Abdullah', '862.0', '21.6', '21.6', 1),
(110, 'order_BzzWpGBs1jl3lZ', 'pay_BzzXtS67MO48wV', 181, 'Royal Enfield Classic 350', 40, 'Journey Wheels Office', '24/02/2019 09:31', '  Journey Wheels Office', '25/02/2019 20:15', '1', '2019-02-24 03:12:30', '2520', 'venkat.d113@gmail.com', '9177775148', 'venkat das', '2400.0', '60.0', '60.0', 1),
(111, 'order_C03V3R3DubEPNY', 'pay_C03X7JIiVYcffB', 183, 'ACCESS 125', 67, 'NAD Junction', '24/02/2019 12:28', '  NAD Junction', '26/02/2019 12:28', '5', '2019-02-24 07:06:26', '905.2', 'sspavan96@gmail.com', '7075497222', 'S Pavan kumar', '862.0', '21.6', '21.6', 1),
(112, 'order_C03aOGEWdBuHc8', 'pay_C03be4fFuqawPr', 183, 'JUPITER GRANDE', 69, 'NAD Junction', '24/02/2019 12:28', '  NAD Junction', '26/02/2019 12:28', '5', '2019-02-24 07:10:12', '892.6', 'sspavan96@gmail.com', '7075497222', 'S Pavan kumar', '850.0', '21.3', '21.3', 1),
(113, 'order_C04EsIHzWNMZA2', 'pay_C04JGwAtl3suTx', 184, 'JUPITER CLASSIC', 68, 'Journey Wheels Office', '24/02/2019 13:15', '  Journey Wheels Office', '25/02/2019 13:15', '5', '2019-02-24 07:50:38', '453.6', 'pavanvittal@gmail.com', '9000778641', 'Pavan kumar', '432.0', '10.8', '10.8', 1),
(114, 'order_C0QeYkIXlWJv6L', 'pay_C0QfT0uWkTfJ41', 185, 'Vespa', 65, 'Journey Wheels Office', '25/02/2019 11:10', '  Journey Wheels Office', '26/02/2019 11:10', '1', '2019-02-25 05:46:32', '525', 'settimahesh@gmail.com', '7899357125', 'Setti mahesh', '500.0', '12.5', '12.5', 1),
(115, 'order_C0Th3uEI3VRATw', 'pay_C0Ti4Hk5WZcsmx', 55, 'ACCESS 125', 67, 'Journey Wheels Office', '25/02/2019 10:53', '  NAD Junction', '25/02/2019 15:53', '5', '2019-02-25 08:41:38', '226.3', 'pchakravarthy16@gmail.com', '9440709885', 'PRATHAP CHAKRAVARTHY', '215.5', '5.4', '5.4', 1),
(116, 'order_C0ZAcJkAu2xWmE', 'pay_C0ZF7c9d1ew0Kq', 186, 'ACCESS 125', 70, 'Journey Wheels Office', '25/02/2019 19:15', '  Journey Wheels Office', '26/02/2019 19:15', '1', '2019-02-25 14:06:17', '453.6', 'rajsmily905@gmail.com', '9346495372', 'Sushma', '432.0', '10.8', '10.8', 1),
(117, 'order_C0dGSa4TShz68K', 'pay_C0dHJ8EUoMj1uV', 172, 'Honda active', 8, 'Journey Wheels Office', '25/02/2019 23:31', '  Journey Wheels Office', '04/03/2019 23:31', '2', '2019-02-25 18:03:06', '2793', 'allagapally.rahul@gmail.com', '9618977440', 'ALLEGAPALLY Rahul', '2660.0', '66.5', '66.5', 1),
(118, 'order_C0m7m1pXmiHo6z', 'pay_C0m9h5PttolRKt', 187, 'Jupiter classic', 13, 'Journey Wheels Office', '26/02/2019 08:15', '  Railway Station', '26/02/2019 22:45', '2', '2019-02-26 02:44:19', '399', 'chesshawk90@gmail.com', '7899326672', 'Chaitanya Bn', '380.0', '9.5', '9.5', 1),
(119, 'order_C0tGRJj3BDLwQ1', 'pay_C0tINizA15WbzI', 191, 'HONDA ACTIVA 5G', 73, 'Journey Wheels Office', '26/02/2019 15:08', '  Journey Wheels Office', '27/02/2019 15:09', '1', '2019-02-26 09:43:22', '453.3', 'munna9ravi59@gmail.com', '7036215434', 'Raviteja', '431.7', '10.8', '10.8', 1),
(120, 'order_C0wwOKJoZMbMOY', 'pay_C0zJW5TZbG5Rp2', 186, 'ACCESS 125', 70, 'Journey Wheels Office', '26/02/2019 20:30', '  Journey Wheels Office', '27/02/2019 20:30', '1', '2019-02-26 15:36:29', '453.6', 'rajsmily905@gmail.com', '9346495372', 'Sushma', '432.0', '10.8', '10.8', 1),
(121, 'order_C10lSK5QpktdaP', 'pay_C10lmoEfNgi4rv', 192, 'ACCESS 125', 70, 'Bus Stand', '27/02/2019 10:30', '  Bus Stand', '02/03/2019 10:30', '1', '2019-02-26 17:03:21', '1360.8', 'anuvind.r07@gmail.com', '7095777323', 'Avunind', '1296.0', '32.4', '32.4', 1),
(122, 'order_C1E0eNwVl1Aw55', 'pay_C1E1867wt72d5l', 193, 'Yamaha Rayzr', 37, 'Bus Stand', '27/02/2019 11:57', '  Bus Stand', '27/02/2019 23:00', '1', '2019-02-27 05:59:32', '452.6', 'ramsy777@gmail.com', '9885961359', 'Ramamuni Reddy', '431.0', '10.8', '10.8', 1),
(123, 'order_C1GLQqPWtH6q75', 'pay_C1GNeHt7FxDF9N', 191, 'HONDA ACTIVA 5G', 73, 'Journey Wheels Office', '27/02/2019 15:15', '  Journey Wheels Office', '28/02/2019 15:15', '1', '2019-02-27 08:18:56', '452.6', 'munna9ravi59@gmail.com', '7036215434', 'Raviteja', '431.0', '10.8', '10.8', 1),
(124, 'order_C1IPMjbkEhs9t0', 'pay_C1IQxPLY3sTvv4', 196, 'HONDA ACTIVA 5G', 73, 'Bus Stand', '27/02/2019 16:00', '  Bus Stand', '27/02/2019 21:00', '1', '2019-02-27 10:18:47', '226.3', 'durgabhaskara446@gmail.com', '9949776822', 'Bhaskar', '215.5', '5.4', '5.4', 1),
(125, 'order_C1PfSptaYNtRJv', 'pay_C1PiRQeyqa3Kc3', 199, 'Royal Enfield Classic 350', 40, 'Journey Wheels Office', '28/02/2019 17:00', '  Journey Wheels Office', '02/03/2019 17:30', '1', '2019-02-27 17:27:18', '3087', 'luckylovely100@gmail.com', '7780702581', 'Jaswanth', '2940.0', '73.5', '73.5', 1),
(126, 'order_C1eFd1lsWG7Js9', 'pay_C1eGw33dH6C35K', 200, 'PULSAR 150', 74, 'NAD Junction', '28/02/2019 12:55', '  NAD Junction', '28/02/2019 23:55', '5', '2019-02-28 07:40:30', '699.4', 'pavanbtech12@gmail.com', '8184960490', 'Pavan', '666.0', '16.7', '16.7', 1),
(127, 'order_C1eixpH9GVJRcV', 'pay_C1ekc6uWDHUsxL', 191, 'HONDA ACTIVA 5G', 73, 'Journey Wheels Office', '28/02/2019 15:15', '  Journey Wheels Office', '01/03/2019 15:15', '1', '2019-02-28 08:08:44', '452.6', 'munna9ravi59@gmail.com', '7036215434', 'Raviteja', '431.0', '10.8', '10.8', 1),
(128, 'order_C1xVvqhJNmBcKB', 'pay_C1xY7xZMbJct9U', 201, 'KTM DUKE 200 CC', 64, 'Journey Wheels Office', '01/03/2019 07:46', '  Journey Wheels Office', '02/03/2019 07:49', '1', '2019-03-01 02:32:08', '1265.2', 'ssudhakarsh67@gmail.com', '8790931389', 'Saka sudhakar', '1205.0', '30.1', '30.1', 1),
(129, 'order_C1yJTtarJ9BEV1', 'pay_C1yLnmMLqs6E0z', 202, 'JUPITER CLASSIC', 68, 'Journey Wheels Office', '01/03/2019 08:42', '  Journey Wheels Office', '02/03/2019 08:44', '5', '2019-03-01 03:19:05', '455', 'dasarikasi26@gmail.com', '9492832119', 'DASARI KASI VISWESWARA Rao', '433.4', '10.8', '10.8', 1),
(130, 'order_C1ydt2MWlfYJTl', 'pay_C1yfDJio3nfw3J', 204, 'ACCESS 125', 67, 'Journey Wheels Office', '01/03/2019 09:00', '  Journey Wheels Office', '02/03/2019 09:00', '5', '2019-03-01 03:37:19', '452.6', 'dasaridany64@gmail.com', '7093550340', 'Muni Kumar', '431.0', '10.8', '10.8', 1),
(131, 'order_C1z8L71xTrprXr', 'pay_C1zDLavPkZKWCC', 138, 'Honda active', 35, 'Railway Station', '01/03/2019 01:00', '  Railway Station', '01/03/2019 08:00', '1', '2019-03-01 04:09:35', '316.7', 'ravitejagollamandala@gmail.com', '9676364487', 'Raviteja', '301.7', '7.5', '7.5', 1),
(132, 'order_C20hNQ7JaA5GbW', 'pay_C20itZnwogPfvl', 161, 'ACTIVA  SAMPLE', 75, 'Journey Wheels Office', '01/03/2019 07:47', '  Journey Wheels Office', '02/03/2019 07:47', '2', '2019-03-01 05:38:22', '9.4', 'saikrishnakatakam999@gmail.com', '7207444448', 'Saikrishna katakam', '9.0', '0.2', '0.2', 1),
(133, 'order_C22HouxTrifDZn', 'pay_C22K9lYYf6M6f0', 136, 'Honda active', 35, 'Bus Stand', '01/03/2019 22:30', '  ', '03/03/2019 22:30', '1', '2019-03-01 07:13:21', '905.2', 'er.abhinesh@gmail.com', '9500416116', 'Abhinesh Parthasarathy', '862.0', '21.6', '21.6', 1),
(134, 'order_C23uTBFfbDNfTl', 'pay_C23w2TLx8aDfzA', 191, 'HONDA ACTIVA 5G', 73, 'Journey Wheels Office', '01/03/2019 15:15', '  Journey Wheels Office', '02/03/2019 15:15', '1', '2019-03-01 08:47:01', '452.6', 'munna9ravi59@gmail.com', '7036215434', 'Raviteja', '431.0', '10.8', '10.8', 1),
(135, 'order_C29OWP9SQkFUhj', 'pay_C29QUbrqUfvjNR', 208, 'Honda activa', 53, 'NAD Junction', '01/03/2019 20:33', '  NAD Junction', '02/03/2019 05:33', '5', '2019-03-01 14:09:02', '405.5', 'rakeshlakka@glocalindia.co.in', '9849807736', 'Rakesh lakka', '386.1', '9.7', '9.7', 1),
(136, 'order_C2Bfb9TnXfddAV', 'pay_C2BhafkCc39rIN', 212, 'Royal Enfield Classic 350', 40, 'Journey Wheels Office', '02/03/2019 18:47', '  Journey Wheels Office', '03/03/2019 18:48', '1', '2019-03-01 16:23:07', '1135.98', 'durgadurgarao68@gmail.com', '9959921992', 'Durham rao', '1202.0', '30.1', '30.1', 1),
(137, 'order_C2CAlw51bfKUGs', 'pay_C2CBU3BSpTiz4n', 211, 'Yamaha Rayzr', 37, 'Journey Wheels Office', '02/03/2019 00:32', '  Journey Wheels Office', '06/03/2019 00:32', '1', '2019-03-01 16:52:38', '1810.2', 'satishkumar9299@gmail.com', '9299104591', 'K UMA NAGA SATISH', '1724.0', '43.1', '43.1', 1),
(138, 'order_C2LUamzTUCbb8v', 'pay_C2LVs0svOplxt3', 209, 'ACCESS 125', 70, 'Bus Stand', '02/03/2019 18:00', '  Bus Stand', '03/03/2019 06:00', '1', '2019-03-02 01:58:29', '453.6', 'hemanthreddyaruva1234@gmail.com', '8309963885', 'Hemanth reddy', '432.0', '10.8', '10.8', 1),
(139, 'order_C2MxGk8A20c675', 'pay_C2MyKUPoQcl4g7', 216, 'Ktm duke 200', 19, 'Journey Wheels Office', '02/03/2019 12:00', '  Journey Wheels Office', '02/03/2019 18:00', '1', '2019-03-02 03:25:08', '680.4', 'sumanth.friend2u@gmail.com', '09652166555', 'K Teja suman', '720.0', '18.0', '18.0', 1),
(140, 'order_C2PDcMOPSyzskd', 'pay_C2PFB41TO6KAmf', 220, 'Vespa', 65, 'Bus Stand', '02/03/2019 15:30', '  Bus Stand', '04/03/2019 15:30', '1', '2019-03-02 05:37:38', '945', 'harikishan359@gmail.com', '9942001044', 'Kishan', '1000.0', '25.0', '25.0', 1),
(141, 'order_C2RImT9P3UYsnc', 'pay_C2RNIfZwzJEhTh', 223, 'Ktm duke 200', 19, 'Journey Wheels Office', '03/03/2019 09:05', '  Railway Station', '03/03/2019 20:05', '1', '2019-03-02 07:42:39', '1260', 'ranjith9505@gmail.com', '8919698482', 'Ranjith kumar', '1200.0', '30.0', '30.0', 1),
(142, 'order_C2RXfczI2WrGt0', 'pay_C2RdOOZGyJ0oRJ', 7, 'PULSAR 150', 74, 'NAD Junction', '02/03/2019 10:05', '  NAD Junction', '19/03/2019 10:05', '5', '2019-03-02 07:57:38', '10699.38', 'saikatakam999@gmail.com', '9391090908', 'SAIKRISHNA KATAKAM', '11322.0', '283.1', '283.1', 1),
(143, 'order_C2RpDHNDcNn5oa', 'pay_C2RpxukBy1RMRw', 191, 'Honda active', 35, 'Journey Wheels Office', '02/03/2019 15:15', '  Journey Wheels Office', '03/03/2019 15:15', '1', '2019-03-02 08:09:58', '407.34', 'munna9ravi59@gmail.com', '7036215434', 'Raviteja', '431.0', '10.8', '10.8', 1),
(144, 'order_C2SKXqDnMRueIJ', 'pay_C2SMyM8KrlRwIV', 225, 'ACCESS 125', 67, 'Journey Wheels Office', '02/03/2019 14:06', '  Journey Wheels Office', '03/03/2019 14:06', '5', '2019-03-02 08:41:51', '452.6', 'inmsanthosh@gmail.com', '7022284673', 'indana navya manikanta santhosh', '431.0', '10.8', '10.8', 1),
(145, 'order_C2Shr3HcQ5KHE7', 'pay_C2St4T17fa2X89', 222, 'Bajaj Pulsar 150cc', 43, 'Railway Station', '02/03/2019 15:00', '  Railway Station', '03/03/2019 15:30', '1', '2019-03-02 09:11:19', '645.03', 'dineshk465@gmail.com', '8523808189', 'Dinesh Kumar', '682.5', '17.1', '17.1', 1),
(146, 'order_C2TVorfDkxGQeL', 'pay_C2TXLMNZEgCg3G', 226, 'JUPITER CLASSIC', 68, 'Journey Wheels Office', '02/03/2019 15:16', '  Journey Wheels Office', '04/03/2019 15:17', '5', '2019-03-02 09:50:03', '1089.3', 'ramalingeshwar.888@gmail.Com', '8886991676', 'ram', '1037.5', '25.9', '25.9', 1),
(147, 'order_C2ZWcAhrC08cWT', 'pay_C2ZXp1YSuHKRU2', 219, 'Honda activa', 53, 'NAD Junction', '02/03/2019 21:09', '  NAD Junction', '03/03/2019 20:09', '5', '2019-03-02 15:42:01', '450.4', 'tj4coding@gmail.com', '9971574459', 'Tejesh Pasupuleti', '429.0', '10.7', '10.7', 1),
(148, 'order_C2l4Ofqx2cevD2', 'pay_C2l6ZtPeuXeSJi', 186, 'JUPITER GRANDE', 69, 'NAD Junction', '03/03/2019 08:26', '  NAD Junction', '04/03/2019 08:25', '5', '2019-03-03 03:00:28', '446.2', 'rajsmily905@gmail.com', '9346495372', 'Sushma', '425.0', '10.6', '10.6', 1),
(149, 'order_C2lMe5GEzYhyXv', 'pay_C2lO6bdgmypzNh', 213, 'Jupiter classic', 13, 'Journey Wheels Office', '03/03/2019 08:44', '  Journey Wheels Office', '03/03/2019 22:55', '2', '2019-03-03 03:17:11', '399', 'vignesh599.vg@gmail.com', '9446968690', 'Vignesh vg', '380.0', '9.5', '9.5', 1),
(150, 'order_C2lScwvhQOYOcU', 'pay_C2lSyNvBQvgTdi', 227, 'Jupiter', 9, 'Journey Wheels Office', '03/03/2019 08:50', '  Journey Wheels Office', '03/03/2019 22:50', '2', '2019-03-03 03:21:50', '399', 'abdulrahman4sadiq@gmail.com', '7012028189', 'Abdul Rahman Sadiq', '380.0', '9.5', '9.5', 1),
(151, 'order_C2mzIVdQRL00wd', 'pay_C2n52L18BIz8ru', 228, 'PULSAR 150', 74, 'Journey Wheels Office', '03/03/2019 10:20', '  Journey Wheels Office', '04/03/2019 10:20', '5', '2019-03-03 04:56:27', '699.4', 'balukbtk1996@gmail.com', '8929001105', 'Bala Tharun', '666.0', '16.7', '16.7', 1),
(152, 'order_C2nEvpwtKqshjV', 'pay_C2nH1RgPyiObP8', 229, 'Jupiter classic', 13, 'Journey Wheels Office', '03/03/2019 10:34', '  Journey Wheels Office', '04/03/2019 10:34', '2', '2019-03-03 05:07:50', '399', 'sairoyal00071992@gmail.com', '7729822229', 'Saihemanth', '380.0', '9.5', '9.5', 1),
(153, 'order_C2rEc7YRZCXNd2', 'pay_C2rGYwKGmuWFaE', 191, 'Honda active', 35, 'Journey Wheels Office', '03/03/2019 15:15', '  Journey Wheels Office', '04/03/2019 15:15', '1', '2019-03-03 09:02:22', '452.6', 'munna9ravi59@gmail.com', '7036215434', 'Raviteja', '431.0', '10.8', '10.8', 1),
(154, 'order_C2rjSRw3TMf1Xo', 'pay_C2rm9qEpmqxKCR', 7, 'Jupiter classic', 13, 'Journey Wheels Office', '03/03/2019 14:50', ' Journey Wheels Office', '18/03/2019 14:50', '2', '2019-03-03 09:32:11', '5985', 'saikatakam999@gmail.com', '9391090908', 'SAIKRISHNA KATAKAM', '5700.0', '142.5', '142.5', 1),
(155, 'order_C2vfEIbk69lTpE', 'pay_C2vgR3L28d1YcC', 88, 'Jupiter classic', 13, 'Journey Wheels Office', '03/03/2019 18:46', '  Journey Wheels Office', '03/03/2019 23:46', '2', '2019-03-03 13:21:24', '199.6', 'abhinavrocky99@gmail.com', '9989191434', 'Abhinav Sai', '190.0', '4.8', '4.8', 1),
(156, 'order_C2xIfifP2bQcyo', 'pay_C2xSD8Gk8Wy1D0', 235, 'ACCESS 125', 67, 'Journey Wheels Office', '03/03/2019 20:25', '  Journey Wheels Office', '04/03/2019 20:25', '5', '2019-03-03 15:07:09', '452.6', 'ramkumarvummiti@gmail.Com', '9989489740', 'ram kumar', '431.0', '10.8', '10.8', 1),
(157, 'order_C3ADcHQ8OGLdou', 'pay_C3AJTXs0c8QJ5K', 238, 'Aprilia 125cc', 6, 'Bus Stand', '04/03/2019 09:45', '  Bus Stand', '05/03/2019 20:30', '2', '2019-03-04 03:41:23', '882', 'chandra_reddys@yahoo.in', '9391789660', 'Chandra sekhar', '840.0', '21.0', '21.0', 1),
(158, 'order_C3AaMNnKU6GhZ3', 'pay_C3Ab08BdVfppT2', 186, 'ACCESS 125', 67, 'NAD Junction', '04/03/2019 09:00', '  NAD Junction', '05/03/2019 09:00', '5', '2019-03-04 03:56:36', '452.6', 'rajsmily905@gmail.com', '9346495372', 'Sushma', '431.0', '10.8', '10.8', 1),
(159, 'order_C3B4Z80HuZsLUF', 'pay_C3B6hLO2m0Sn5D', 239, 'Jupiter classic', 38, 'Journey Wheels Office', '04/03/2019 09:51', '  Railway Station', '05/03/2019 09:51', '1', '2019-03-04 04:26:36', '453.6', 'saraadvt@gmail.com', '9702895666', 'Salim shaikh', '432.0', '10.8', '10.8', 1),
(160, 'order_C3BDUZlWON4AyF', 'pay_C3BEXaUld1Yu03', 240, 'KTM DUKE 250CC', 76, 'Journey Wheels Office', '04/03/2019 10:01', '  Journey Wheels Office', '05/03/2019 09:58', '2', '2019-03-04 04:34:19', '1291.6', 'minnakiran@gmail.com', '8186878947', 'Kiran', '1230.0', '30.8', '30.8', 1),
(161, 'order_C3Gv2XV8ObFz0e', 'pay_C3GvwSR7H4ftCR', 191, 'Honda active', 35, 'Journey Wheels Office', '04/03/2019 15:30', '  Journey Wheels Office', '05/03/2019 15:30', '1', '2019-03-04 10:09:05', '452.6', 'munna9ravi59@gmail.com', '7036215434', 'Raviteja', '431.0', '10.8', '10.8', 1),
(162, 'order_C3JNLtgJHRZUza', 'pay_C3JPbv0ZwjCRmP', 244, 'Honda active', 35, 'Bus Stand', '04/03/2019 18:15', '  Bus Stand', '05/03/2019 18:15', '1', '2019-03-04 12:34:44', '452.6', 'sreebhargava143@gmail.com', '8688916408', 'Sree Bhargava', '431.0', '10.8', '10.8', 1),
(163, 'order_C3Jd1ZcuOIrzDs', 'pay_C3Jdjn5QlORIzP', 245, 'Jupiter classic', 13, 'Bus Stand', '04/03/2019 18:13', '  Journey Wheels Office', '05/03/2019 18:14', '2', '2019-03-04 12:47:54', '399.6', 'pavanroyal544@gmail.com', '9652683003', 'Pavan kalyan', '380.6', '9.5', '9.5', 1),
(164, 'order_C3NjXmMwqIjSh1', 'pay_C3NlPCQOSSvvvW', 247, 'Honda active', 35, 'Railway Station', '04/03/2019 22:16', '  Bus Stand', '05/03/2019 19:16', '1', '2019-03-04 16:49:29', '452.6', 'navabs007@gmail.com', '9100525700', 'Shaik sameer', '431.0', '10.8', '10.8', 1),
(165, 'order_C3ZIoDikPKSwHR', 'pay_C3ZJK4AvdqVjw0', 205, 'Honda active', 35, 'Journey Wheels Office', '05/03/2019 09:35', '  Journey Wheels Office', '05/04/2019 06:30', '1', '2019-03-05 04:07:51', '7715.95', 'rtheja.reddy@gmail.com', '08050164294', 'ravi theja', '13361.0', '334.0', '334.0', 1),
(166, 'order_C3a7G6Dt1aS4tO', 'pay_C3aAWGuneTyC58', 251, 'ACCESS 125', 67, 'Journey Wheels Office', '05/03/2019 10:22', '  Journey Wheels Office', '06/03/2019 10:23', '5', '2019-03-05 04:57:42', '453.3', 'avipydipati@gmail.com', '8639804377', 'Avinash', '431.7', '10.8', '10.8', 1),
(167, 'order_C3b2N0garYXuKP', 'pay_C3b2fyNrK2QPUV', 231, 'Honda active', 35, 'Railway Station', '06/03/2019 03:00', '  Railway Station', '06/03/2019 19:00', '1', '2019-03-05 05:49:46', '452.6', 'tirupathi991@gmail.com', '9494920485', 'Thirupathi Reddy', '431.0', '10.8', '10.8', 1),
(168, 'order_C3cqg4uIRDN2cG', 'pay_C3dDjYdQE25EOv', 192, 'Jupiter classic', 38, 'Bus Stand', '05/03/2019 14:00', '  Bus Stand', '06/03/2019 14:01', '1', '2019-03-05 07:57:10', '454.3', 'anuvind.r07@gmail.com', '7095777323', 'Avunind', '432.7', '10.8', '10.8', 1),
(169, 'order_C3e4rV7DctkoDy', 'pay_C3e5Ty2Bxnagck', 253, 'ACCESS 125', 67, 'NAD Junction', '05/03/2019 14:15', '  Journey Wheels Office', '06/03/2019 14:15', '5', '2019-03-05 08:48:26', '452.6', 'radha.bharath2@gmail.com', '8939532050', 'Dr siva bharath', '431.0', '10.8', '10.8', 1),
(170, 'order_C3itwS96gVRWtE', 'pay_C3iwKxhgAafRGH', 257, 'Bajaj Pulsar 150cc', 43, 'Railway Station', '05/03/2019 20:10', '  Railway Station', '07/03/2019 12:02', '1', '2019-03-05 13:33:36', '1365', 'rakeshchowdaryrr9@gmail.com', '9701674700', 'Rakesh', '1300.0', '32.5', '32.5', 1),
(171, 'order_C3nrLBTithxcq7', 'pay_C3ntYbwBBT74Wk', 216, 'Yamaha FZ 150', 39, 'Journey Wheels Office', '06/03/2019 09:30', '  Journey Wheels Office', '06/03/2019 15:30', '1', '2019-03-05 18:24:41', '425.34', 'sumanth.friend2u@gmail.com', '09652166555', 'K Teja suman', '450.0', '11.3', '11.3', 1),
(172, 'order_C3yx4mxAn2Tyay', 'pay_C3yy6nV9347Hda', 259, 'ACCESS 125', 67, 'Journey Wheels Office', '06/03/2019 15:00', '  Journey Wheels Office', '06/03/2019 21:40', '5', '2019-03-06 05:13:45', '301.7', 'kottupriyatham@gmail.com', '9494573563', 'Priyatham Kottu', '287.3', '7.2', '7.2', 1),
(173, 'order_C43BB9LSDPkacS', 'pay_C43CDO2hRZAGiG', 191, 'HONDA ACTIVA 5G', 73, 'Journey Wheels Office', '05/03/2019 15:30', '  Journey Wheels Office', '07/03/2019 15:30', '1', '2019-03-06 09:21:37', '814.68', 'munna9ravi59@gmail.com', '7036215434', 'Raviteja', '862.0', '21.6', '21.6', 1),
(174, 'order_C496Ejt5w7jKme', 'pay_C498UarAMXpiSd', 246, 'Vespa', 65, 'Railway Station', '06/03/2019 20:37', '  Bus Stand', '07/03/2019 20:37', '1', '2019-03-06 15:10:07', '525', 'achowdary396@gmail.com', '9951350252', 'Mandava Venkata akhil', '500.0', '12.5', '12.5', 1),
(175, 'order_C49Wv7rJwIqexb', 'pay_C49XOLHvrsfziB', 211, 'Yamaha Rayzr', 37, 'Journey Wheels Office', '07/03/2019 00:35', '  Journey Wheels Office', '09/03/2019 00:35', '1', '2019-03-06 15:33:38', '905.2', 'satishkumar9299@gmail.com', '9299104591', 'K UMA NAGA SATISH', '862.0', '21.6', '21.6', 1),
(176, 'order_C4PislS7iLM8lL', 'pay_C4PklLaFHOfJAe', 261, 'Jupiter classic', 38, 'Bus Stand', '09/03/2019 04:30', '  Bus Stand', '10/03/2019 18:00', '1', '2019-03-07 07:25:38', '816.48', 'srkanth33@gmail.com', '9908299139', 'Srikanth', '864.0', '21.6', '21.6', 1),
(177, 'order_C4RSBTElu0hp9x', 'pay_C4RTAJTUION5Ug', 263, 'ACCESS 125', 67, 'Journey Wheels Office', '07/03/2019 14:33', '  Journey Wheels Office', '08/03/2019 14:33', '5', '2019-03-07 09:06:01', '452.6', 'dpraveenk1998@gmail.com', '9556002224', 'DASARI PRAVEEN KUMAR', '431.0', '10.8', '10.8', 1),
(178, 'order_C4T9kuhjmooqoV', 'pay_C4TBonx6qWqzpu', 264, 'Honda active', 35, 'Bus Stand', '07/03/2019 16:30', '  Bus Stand', '09/03/2019 16:30', '1', '2019-03-07 10:47:57', '905.2', 'yoga206@gmail.com', '7288877897', 'R YOGANAND', '862.0', '21.6', '21.6', 1),
(179, 'order_C4U2OLuLtmH5MC', 'pay_C4U32IgfMU8jTK', 191, 'Honda active', 35, 'Journey Wheels Office', '07/03/2019 15:30', '  Journey Wheels Office', '08/03/2019 15:30', '1', '2019-03-07 11:37:39', '407.34', 'munna9ravi59@gmail.com', '7036215434', 'Raviteja', '431.0', '10.8', '10.8', 1),
(180, 'order_C4i04RKzXyjv6z', 'pay_C4i0Y54HHNzbqZ', 267, 'Honda active', 35, 'Bus Stand', '09/03/2019 08:30', '  Bus Stand', '11/03/2019 08:30', '1', '2019-03-08 01:17:20', '814.68', 'kumarkarthikgrandhi@gmail.com', '8885190711', 'Karthik', '862.0', '21.6', '21.6', 1),
(181, 'order_C4jdxSaP3msNFF', 'pay_C4jfL4Ny3IAuha', 268, 'PULSAR 150', 74, 'Journey Wheels Office', '08/03/2019 08:20', '  Journey Wheels Office', '08/03/2019 20:20', '5', '2019-03-08 02:54:11', '699.4', 'manjunathlpu@gmail.com', '9703530333', 'K P MANJUNATH', '666.0', '16.7', '16.7', 1),
(182, 'order_C4mUlGZzBm7jVS', 'pay_C4miAuRNOw1ri8', 269, 'Honda active', 35, 'Journey Wheels Office', '08/03/2019 11:30', '  Journey Wheels Office', '09/03/2019 05:00', '1', '2019-03-08 05:53:23', '407.34', 'rajat.pandey1412@gmail.com', '7411637615', 'Prateek', '431.0', '10.8', '10.8', 1),
(183, 'order_C4mmQXbTaZC7LI', 'pay_C4mminVcu4qLF1', 269, 'Honda active', 35, 'Journey Wheels Office', '08/03/2019 11:30', '  Journey Wheels Office', '09/03/2019 05:30', '1', '2019-03-08 05:57:18', '407.34', 'rajat.pandey1412@gmail.com', '7411637615', 'Prateek', '431.0', '10.8', '10.8', 1),
(184, 'order_C4sS3kOzjmqUfv', 'pay_C4sTJLrrkXwJqd', 270, 'TVS Apache', 42, 'Railway Station', '08/03/2019 17:30', '  Railway Station', '09/03/2019 17:30', '1', '2019-03-08 11:34:53', '661.5', 'darisa.subhash06@gmail.com', '7416341932', 'Subhash Darisha', '700.0', '17.5', '17.5', 1),
(185, 'order_C4sl8Nef0YhUZL', 'pay_C4slsJd1kj62HK', 191, 'Honda active', 35, 'Journey Wheels Office', '08/03/2019 15:30', '  Journey Wheels Office', '09/03/2019 15:30', '1', '2019-03-08 11:48:45', '407.34', 'munna9ravi59@gmail.com', '7036215434', 'Raviteja', '431.0', '10.8', '10.8', 1),
(186, 'order_C4tg8b8Cbc2J6I', 'pay_C4tmkl0ByUuEPg', 83, 'Jupiter classic', 13, 'Journey Wheels Office', '08/03/2019 20:30', '  Journey Wheels Office', '09/03/2019 20:01', '2', '2019-03-08 12:48:44', '399', 'suryareddymuthaluru@gmail.com', '8095853851', 'Lingareddy chaithanya Kumar reddy', '380.0', '9.5', '9.5', 1),
(187, 'order_C4uBVUZDmhgueE', 'pay_C4uD2ev0rbS9BW', 272, 'Jupiter classic', 13, 'Journey Wheels Office', '08/03/2019 18:40', '  Journey Wheels Office', '10/03/2019 18:40', '2', '2019-03-08 13:13:02', '798', 'bboyprats@gmail.com', '7666526615', 'Pratik pawar', '760.0', '19.0', '19.0', 1),
(188, 'order_C5DNHaeyzZ8zMU', 'pay_C5DOgZF5Xwzp5q', 154, 'Jupiter classic', 13, 'Journey Wheels Office', '10/03/2019 09:50', '  Journey Wheels Office', '11/03/2019 23:50', '2', '2019-03-09 07:59:39', '718.2', 'ROHITHCRAZY999@GMAIL.COM', '9666660003', 'Rohit', '760.0', '19.0', '19.0', 1),
(189, 'order_C5DiKGcZCEq0jF', 'pay_C5DlEa8Ax5476G', 278, 'ACCESS 125', 67, 'NAD Junction', '09/03/2019 15:30', '  NAD Junction', '09/03/2019 22:00', '5', '2019-03-09 08:20:48', '264.78', 'swaroop1179@gmail.com', '9000835820', 'Swaroop', '280.2', '7.0', '7.0', 1);
INSERT INTO `customers_orders` (`id`, `razorpay_order_id`, `payment_id`, `customer_id`, `vehicle_title`, `vehicle_id`, `pick_location`, `pick_datetime`, `drop_location`, `drop_datetime`, `location`, `order_date`, `amount`, `email`, `contact_no`, `name`, `rent`, `tax`, `tax1`, `hel`) VALUES
(190, 'order_C5JihUzqZdILUi', 'pay_C5Jjn02zZJIoR2', 280, 'PULSAR 150', 74, 'NAD Junction', '09/03/2019 19:40', '  NAD Junction', '10/03/2019 19:41', '5', '2019-03-09 14:11:10', '700.5', 'srikarji92@gmail.com', '7207705363', 'Srikar', '667.1', '16.7', '16.7', 1),
(191, 'order_C5K643gd9lo39O', 'pay_C5K7AtMbUTGrhX', 282, 'Yamaha Fz 3.0', 80, 'Journey Wheels Office', '09/03/2019 19:38', '  Journey Wheels Office', '11/03/2019 19:38', '5', '2019-03-09 14:33:35', '1722', 'tejasai7857@gmail.Com', '7036770413', 'p.Teja', '1640.0', '41.0', '41.0', 1),
(192, 'order_C5TSBvTLfN8x96', 'pay_C5TTj2Xz51h6ut', 285, 'TVS Apache', 42, 'Bus Stand', '10/03/2019 06:30', '  Bus Stand', '10/03/2019 12:30', '1', '2019-03-09 23:42:53', '441', 'talk2sekhar.sg@gmail.com', '08179969789', 'Guna Sekhar', '420.0', '10.5', '10.5', 1),
(193, 'order_C5fFTmRrJa23GP', 'pay_C5fG9ix42eU26G', 100, 'Jupiter classic', 13, 'Journey Wheels Office', '11/03/2019 08:42', '  Journey Wheels Office', '13/03/2019 08:42', '2', '2019-03-10 11:14:43', '798', 'ranbuezhil@gmail.com', '9962104745', 'Anbuezhil', '760.0', '19.0', '19.0', 1),
(194, 'order_C5gI6iTknTNpPO', 'pay_C5gKQWlbLf2vdG', 283, 'Jupiter classic', 13, 'Railway Station', '12/03/2019 20:15', '  Railway Station', '14/03/2019 17:30', '2', '2019-03-10 12:17:57', '798', 'mlnareshkumar@gmail.com', '9884627374', 'Naresh Kumar', '760.0', '19.0', '19.0', 1),
(195, 'order_C5hMiu1gPs4cCS', 'pay_C5hNLgn70cF5Fl', 191, 'HONDA ACTIVA 5G', 79, 'Journey Wheels Office', '09/03/2019 15:30', '  Journey Wheels Office', '11/03/2019 15:30', '1', '2019-03-10 13:19:00', '814.68', 'munna9ravi59@gmail.com', '7036215434', 'Raviteja', '862.0', '21.6', '21.6', 1),
(196, 'order_C5mtxjk5yT5yge', 'pay_C5mwoncgjmC7K8', 289, 'Aprilia 125cc', 6, 'Bus Stand', '11/03/2019 05:06', '  Bus Stand', '11/03/2019 20:07', '2', '2019-03-10 18:45:44', '441', 'dileep2301@gmail.com', '9704442724', 'Dileep kumar kola', '420.0', '10.5', '10.5', 1),
(197, 'order_C6GtTDl9PWcdnE', 'pay_C6GwNSM4PJWKtL', 295, 'Royal Enfield Classic 350', 40, 'Bus Stand', '12/03/2019 05:32', '  Bus Stand', '14/03/2019 05:32', '1', '2019-03-12 00:06:52', '2520', 'balasubramanyan.302@gmail.com', '9640899969', 'balasubramanyan', '2400.0', '60.0', '60.0', 1),
(198, 'order_C6QOeyWR3Glsip', 'pay_C6QQ4jyARXwBrd', 191, 'HONDA ACTIVA 5G', 79, 'Journey Wheels Office', '11/03/2019 15:30', '  Journey Wheels Office', '13/03/2019 15:30', '1', '2019-03-12 09:22:42', '814.68', 'munna9ravi59@gmail.com', '7036215434', 'Raviteja', '862.0', '21.6', '21.6', 1),
(199, 'order_C6UTM704VKv3K5', 'pay_C6UYKDCwhh9Yr7', 83, 'Jupiter classic', 13, 'Journey Wheels Office', '13/03/2019 20:00', '  Journey Wheels Office', '14/03/2019 20:00', '2', '2019-03-12 13:25:26', '359.1', 'suryareddymuthaluru@gmail.com', '8095853851', 'Lingareddy chaithanya Kumar reddy', '380.0', '9.5', '9.5', 1),
(200, 'order_C6WlY6UGNQmHDX', 'pay_C6WmGR6iEMOHOp', 300, 'Ktm duke 200', 19, 'Journey Wheels Office', '13/03/2019 19:00', '  Journey Wheels Office', '14/03/2019 19:00', '1', '2019-03-12 15:37:31', '1260', 'sram556676@gmail.com', '8919682661', 'Sir ram', '1200.0', '30.0', '30.0', 1),
(201, 'order_C6XBurhwxLqDEZ', 'pay_C6XETcAqyVk3HL', 290, 'Ktm duke 200', 19, 'Bus Stand', '14/03/2019 08:30', '  Bus Stand', '14/03/2019 19:00', '1', '2019-03-12 16:02:51', '1134', 'vihariphani456@gmail.com', '8374401353', 'Phani Vihari', '1200.0', '30.0', '30.0', 1),
(202, 'order_C6hmO5SrvHd84c', 'pay_C6hnRQ1mYDHRqO', 305, 'Bajaj Pulsar 150cc', 43, 'Journey Wheels Office', '13/03/2019 10:00', '  Journey Wheels Office', '14/03/2019 10:01', '1', '2019-03-13 02:22:21', '683.7', 'vamsiyerra09@gmail.com', '9515267722', 'Venkata vamsi yerra', '651.1', '16.3', '16.3', 1),
(203, 'order_C6ho5t8jhk8eWB', 'pay_C6hpRF8AftHVvw', 308, 'ACCESS 125', 70, 'Journey Wheels Office', '13/03/2019 10:00', '  Journey Wheels Office', '14/03/2019 10:00', '1', '2019-03-13 02:24:12', '453.6', 'ramganesh0007@gmail.com', '7386646465', 'Ram Ganesh', '432.0', '10.8', '10.8', 1),
(204, 'order_C6hrxzqgDwN5CU', 'pay_C6htmzqcKHMY0z', 309, 'ACCESS 125', 70, 'Journey Wheels Office', '13/03/2019 09:00', '  Journey Wheels Office', '14/03/2019 09:00', '1', '2019-03-13 02:28:18', '453.6', 'rajarshimintoo@gmail.com', '9959526446', 'Rajarshi Latti', '432.0', '10.8', '10.8', 1),
(205, 'order_C6huaNkRmU0hNT', 'pay_C6huylEZg7hewz', 306, 'Yamaha FZ 150', 39, 'Journey Wheels Office', '13/03/2019 10:00', '  Journey Wheels Office', '14/03/2019 10:00', '1', '2019-03-13 02:29:25', '787.6', 'boyinaayyappa@gmail.com', '7702275626', 'Ayyappa boyina', '750.0', '18.8', '18.8', 1),
(206, 'order_C6mGVBBh6ctCZg', 'pay_C6mHa6Y9giI1Wu', 311, 'JUPITER GRANDE', 69, 'NAD Junction', '13/03/2019 13:00', '  NAD Junction', '14/03/2019 10:59', '5', '2019-03-13 06:45:58', '446.2', 'sainipankaj008@gmail.com', '9873362234', 'Pankaj kumar', '425.0', '10.6', '10.6', 1),
(207, 'order_C77OACqkvUb918', 'pay_C77SAB5Tjxl0yP', 322, 'Tvs ntarQ', 45, 'Journey Wheels Office', '14/03/2019 11:17', '  Journey Wheels Office', '14/03/2019 18:00', '4', '2019-03-14 03:31:21', '222.21', 'chaitanyagoru@ymail.com', '9000388028', 'Chaitanya Goru', '235.1', '5.9', '5.9', 1),
(208, 'order_C77xkUq5ymgYoN', 'pay_C782bqa9LwwZQ3', 135, 'Suziki Access 125', 63, 'Journey Wheels Office', '14/03/2019 10:30', '  Journey Wheels Office', '16/03/2019 09:30', '2', '2019-03-14 04:02:49', '882', '9000naga@gmail.com', '9121025482', 'Nagendra reddy Sirigiri', '840.0', '21.0', '21.0', 1),
(209, 'order_C7Fc2N2oDXhuOt', 'pay_C7FfYBYFM3LxI6', 259, 'PULSAR 150', 74, 'Journey Wheels Office', '14/03/2019 16:54', '  Journey Wheels Office', '14/03/2019 21:54', '5', '2019-03-14 11:31:20', '349.6', 'kottupriyatham@gmail.com', '9494573563', 'Priyatham Kottu', '333.0', '8.3', '8.3', 1),
(210, 'order_C7ICM1lQm9nUv7', 'pay_C7ICx27IbU6zIl', 83, 'Jupiter classic', 13, 'Journey Wheels Office', '16/03/2019 20:00', '  Journey Wheels Office', '17/03/2019 20:00', '2', '2019-03-14 14:00:12', '359.1', 'suryareddymuthaluru@gmail.com', '8095853851', 'Lingareddy chaithanya Kumar reddy', '380.0', '9.5', '9.5', 1),
(211, 'order_C7IvcIFYB1bIh8', 'pay_C7IxvTssAt6nzV', 324, 'Jupiter classic', 13, 'Railway Station', '15/03/2019 05:15', '  Railway Station', '17/03/2019 21:30', '2', '2019-03-14 14:44:42', '1077.3', 'mrvenkateshindian@gmail.com', '8892106058', 'S venkatesh', '1140.0', '28.5', '28.5', 1),
(212, 'order_C7K2sVnnZgynfD', 'pay_C7K4DOhxkVQ8g7', 327, 'Jupiter classic', 13, 'Journey Wheels Office', '14/03/2019 21:14', '  Journey Wheels Office', '15/03/2019 21:14', '2', '2019-03-14 15:48:46', '359.1', 'tejasurya213@gmail.com', '8309987128', 'Surya', '380.0', '9.5', '9.5', 1),
(213, 'order_C7MqQ2CrnFD9mB', 'pay_C7MwZA0aUvPH5v', 328, 'Suziki Access 125', 63, 'Bus Stand', '16/03/2019 06:00', '  Bus Stand', '17/03/2019 12:01', '2', '2019-03-14 18:37:52', '756.3', 'senthilkumartts@gmail.com', '9538555659', 'senthilkumar', '672.7', '16.8', '16.8', 1),
(214, 'order_C7Wgm4ccIKgUvb', 'pay_C7WtkhK4Xvtjt7', 330, 'ACCESS 125', 70, 'Bus Stand', '15/03/2019 09:45', '  Bus Stand', '17/03/2019 09:45', '1', '2019-03-15 04:22:44', '816.48', 'prasaad.urs@gmail.com', '9959073590', 'Varaprasad', '864.0', '21.6', '21.6', 1),
(215, 'order_C7Y2SytwHKdzAk', 'pay_C7YGK9yMl9WeO9', 331, 'ACCESS 125', 70, 'Bus Stand', '15/03/2019 00:00', '  Bus Stand', '15/03/2019 22:00', '1', '2019-03-15 05:41:58', '453.6', 'viratvijay62@gmail.com', '9148543311', 'Virat', '432.0', '10.8', '10.8', 1),
(216, 'order_C7YvZbgvbvltgY', 'pay_C7YxylDuDpsEcM', 332, 'Yamaha Fz 3.0', 81, 'Journey Wheels Office', '15/03/2019 11:49', '  Journey Wheels Office', '16/03/2019 11:49', '5', '2019-03-15 06:23:28', '861', 'rangaswamyjay1996@gmail.com', '6301911585', 'Muthu haravindan', '820.0', '20.5', '20.5', 1),
(217, 'order_C85aZF6oUaPS3A', 'pay_C85jF2afJAHN8v', 339, 'Yamaha rayz street rally', 12, 'Journey Wheels Office', '16/03/2019 19:45', '  Journey Wheels Office', '18/03/2019 19:45', '2', '2019-03-16 14:26:28', '756', '1995dulipalasekhar@gmail.com', '9177602852', 'Shekar', '800.0', '20.0', '20.0', 1),
(218, 'order_C86coJWjV0gYhk', 'pay_C86dihrcnONLIf', 340, 'ACCESS 125', 70, 'Bus Stand', '16/03/2019 21:00', '  Bus Stand', '17/03/2019 09:01', '1', '2019-03-16 15:19:35', '408.24', 'venkatsai757@gmail.com', '8790985423', 'vajinepalli sai venkata apparao', '432.0', '10.8', '10.8', 1),
(219, 'order_C8HqdxjToFdIfR', 'pay_C8HrDeBFfOajZh', 344, 'ACCESS 125', 70, 'Railway Station', '17/03/2019 08:06', '  Railway Station', '17/03/2019 21:46', '1', '2019-03-17 02:18:13', '408.24', 'vikashranjan457@gmail.com', '8789460229', 'Vikash Ranjan', '432.0', '10.8', '10.8', 1),
(220, 'order_C8ISfxZone3XAq', 'pay_C8IWumlfBufGGa', 345, 'Bajaj Pulsar 150cc', 43, 'Railway Station', '17/03/2019 09:30', '  Railway Station', '18/03/2019 23:00', '1', '2019-03-17 03:07:08', '1228.5', 'kiranoif@gmail.com', '9701940960', 'Kiran prasad', '1300.0', '32.5', '32.5', 1),
(221, 'order_C8JK3uLVy3TbIm', 'pay_C8JLdaaOgZCjtc', 346, 'ACCESS 125', 67, 'Journey Wheels Office', '17/03/2019 09:13', '  Journey Wheels Office', '19/03/2019 09:13', '5', '2019-03-17 03:46:26', '905.2', 'karthikavi03@gmail.Com', '8639211702', 'Karthik N', '862.0', '21.6', '21.6', 1),
(222, 'order_C8KmL0gJbEYLNh', 'pay_C8KmjxYx6jzNWi', 347, 'ACCESS 125', 70, 'Railway Station', '17/03/2019 11:00', '  Railway Station', '17/03/2019 19:00', '1', '2019-03-17 05:10:33', '362.8', 'd.v.s.phanikrishna@gmail.com', '9100235006', 'Phani', '345.6', '8.6', '8.6', 1),
(223, 'order_C8PUDPR3j62qxv', 'pay_C8PUs563UFqNwf', 191, 'ACCESS 125', 70, 'Journey Wheels Office', '13/03/2019 15:30', '  Journey Wheels Office', '17/03/2019 15:30', '1', '2019-03-17 09:48:17', '1632.96', 'munna9ravi59@gmail.com', '7036215434', 'Raviteja', '1728.0', '43.2', '43.2', 1),
(224, 'order_C8Sw5z4ngSGODl', 'pay_C8SzemkqNXRVRA', 349, 'PULSAR 150', 74, 'NAD Junction', '17/03/2019 18:30', '  NAD Junction', '18/03/2019 18:31', '5', '2019-03-17 13:11:32', '630.45', 'durgaprasadvasamshetti@gmail.com', '9618993272', 'Durga Prasad', '667.1', '16.7', '16.7', 1),
(225, 'order_C8UaaOXoXAZgeJ', 'pay_C8UbY32eYpIZNG', 350, 'Honda activa', 53, 'Journey Wheels Office', '17/03/2019 20:11', '  Journey Wheels Office', '18/03/2019 20:11', '5', '2019-03-17 14:46:27', '405.36', 'Pavanpuppala3@gmail.com', '9642961042', 'Pavan kumar Puppala', '429.0', '10.7', '10.7', 1),
(226, 'order_C8o2fxAXug0oEI', 'pay_C8o3TTrpwGcu8q', 354, 'ACCESS 125', 70, 'Journey Wheels Office', '18/03/2019 15:15', '  Journey Wheels Office', '19/03/2019 15:15', '1', '2019-03-18 09:47:49', '453.6', 'sidheartsid@gmail.com', '9043950051', 'Sri Siddhardha Singupurapu', '432.0', '10.8', '10.8', 1),
(227, 'order_C8sKwox64JDHJ2', 'pay_C8sMf3qjbgYfAO', 355, 'ACCESS 125', 70, 'Bus Stand', '19/03/2019 13:00', '  Bus Stand', '23/03/2019 10:00', '1', '2019-03-18 14:00:32', '1814.4', 'pavan.official125@gmail.com', '9703806267', 'Pavan', '1728.0', '43.2', '43.2', 1),
(228, 'order_C8tOodq0Yz9orH', 'pay_C8tQc7lBp0L3EG', 358, 'JUPITER GRANDE', 69, 'Journey Wheels Office', '18/03/2019 20:30', '  Journey Wheels Office', '20/03/2019 20:30', '5', '2019-03-18 15:03:42', '892.6', 'kumar.harish027@gmail.com', '7993864779', 'Harish kumar', '850.0', '21.3', '21.3', 1),
(229, 'order_C8xImCkETc9L6W', 'pay_C8xKMq1jKh9kwZ', 359, 'YAMAHA FZ 150CC', 83, 'Bus Stand', '23/03/2019 07:00', '  Bus Stand', '24/03/2019 19:00', '1', '2019-03-18 18:52:11', '1415.7', 'jeswanthbangaram0335@gmail.com', '8897469259', 'Jeswanth', '1498.0', '37.5', '37.5', 1),
(230, 'order_C95CYTyeBTqH2O', 'pay_C95DYjasv2AyRB', 360, 'ACCESS 125', 70, 'Journey Wheels Office', '19/03/2019 08:02', '  Journey Wheels Office', '19/03/2019 14:00', '1', '2019-03-19 02:35:14', '270.6', 'inumulap@gmail.com', '9949337879', 'Pavan kumar', '257.8', '6.4', '6.4', 1),
(231, 'order_C9C4nReH8Zmol6', 'pay_C9C64r7wq4yLOg', 364, 'Jupiter classic', 10, 'Journey Wheels Office', '19/03/2019 14:43', '  Journey Wheels Office', '20/03/2019 14:43', '2', '2019-03-19 09:19:00', '359.1', 'shaikbaji606@gmail.com', '8143145086', 'Shaik baji', '380.0', '9.5', '9.5', 1),
(232, 'order_C9HMX7LU6HdD1J', 'pay_C9HPQwIkXTUcex', 322, 'HONDA ACTIVA 5G', 73, 'Railway Station', '20/03/2019 10:30', '  Railway Station', '22/03/2019 01:05', '1', '2019-03-19 14:30:53', '841.14', 'chaitanyagoru@ymail.com', '9000388028', 'Chaitanya Goru', '890.0', '22.3', '22.3', 1),
(233, 'order_C9IDLEybryXPj6', 'pay_C9IEBj0LYBvrAy', 366, 'Jupiter classic', 10, 'Journey Wheels Office', '20/03/2019 10:00', '  Journey Wheels Office', '21/03/2019 10:00', '2', '2019-03-19 15:19:00', '359.1', 'venky99.v@gmail.com', '9393988491', 'Thota venkatesh', '380.0', '9.5', '9.5', 1),
(234, 'order_C9bWgNiaf3dj5m', 'pay_C9babDRhNacmTA', 153, 'YAMAHA FASCINO', 97, 'Journey Wheels Office', '29/03/2019 18:00', '  Journey Wheels Office', '30/03/2019 18:00', '1', '2019-03-20 10:15:35', '461', 'chaitanyakillada9@gmail.com', '7287812529', 'Chaitanya', '439.0', '11.0', '11.0', 1),
(235, 'order_C9swI8woHhTApH', 'pay_C9swrwXPuJXjco', 65, 'Jupiter classic', 38, 'Journey Wheels Office', '21/03/2019 08:45', '  Journey Wheels Office', '21/03/2019 20:30', '1', '2019-03-21 03:15:42', '400.69', 'ashokkopparapu999@gmail.com', '8125474799', 'Ashok', '449.0', '11.2', '11.2', 1),
(236, 'order_C9sy8D6zw0WHG9', 'pay_C9syUg1RRbfEV1', 100, 'Jupiter classic', 10, 'Journey Wheels Office', '21/03/2019 09:40', '  Journey Wheels Office', '22/03/2019 08:40', '2', '2019-03-21 03:18:45', '399', 'ranbuezhil@gmail.com', '9962104745', 'Anbuezhil', '380.0', '9.5', '9.5', 1),
(237, 'order_C9tHCJtzZBNEus', 'pay_C9tHuQmpZxNtDU', 366, 'Jupiter classic', 10, 'Journey Wheels Office', '21/03/2019 10:00', '  Journey Wheels Office', '22/03/2019 10:00', '2', '2019-03-21 03:34:01', '359.1', 'venky99.v@gmail.com', '9393988491', 'Thota venkatesh', '380.0', '9.5', '9.5', 1),
(238, 'order_CA2S6t8WNigNm2', 'pay_CA2TNcWF5t52bV', 65, 'ACCESS 125', 70, 'Journey Wheels Office', '21/03/2019 18:03', '  Journey Wheels Office', '23/03/2019 18:03', '1', '2019-03-21 12:33:07', '801.55', 'ashokkopparapu999@gmail.com', '8125474799', 'Ashok', '898.0', '22.5', '22.5', 1),
(239, 'order_CA6RRGbSRr7kkV', 'pay_CA6SzEsWEYvDT2', 100, 'Jupiter classic', 10, 'Journey Wheels Office', '22/03/2019 09:53', '  Journey Wheels Office', '23/03/2019 09:53', '2', '2019-03-21 16:28:07', '399', 'ranbuezhil@gmail.com', '9962104745', 'Anbuezhil', '380.0', '9.5', '9.5', 1),
(240, 'order_CATXQhf1nHnFnc', 'pay_CATYUcYGTQdfEu', 376, 'KTM DUKE 250CC', 76, 'Journey Wheels Office', '22/03/2019 20:30', '  Journey Wheels Office', '23/03/2019 20:30', '2', '2019-03-22 15:02:28', '1337.9', 'suri.it.2000@gmail.com', '7997526124', 'SURESH', '1499.0', '37.5', '37.5', 1),
(241, 'order_CAUHXxZBHQbTVF', 'pay_CAUImYz7Jr4Pn9', 373, 'HONDA ACTIVA 5G', 79, 'Railway Station', '24/03/2019 05:30', '  Railway Station', '24/03/2019 17:30', '1', '2019-03-22 15:47:48', '471.4', 'ploshith2012@gmail.com', '9493225774', 'P SREE HARI', '449.0', '11.2', '11.2', 1),
(242, 'order_CAhjXbDwcnDVyn', 'pay_CAhlN9Ou1eGV5e', 0, 'Jupiter classic', 10, 'Railway Station', '12/04/2019 13:45', '  Railway Station', '13/04/2019 15:15', '2', '2019-03-23 04:57:04', '412.92', '', '', '', '437.0', '10.9', '10.9', 1),
(243, 'order_CAhvaJwHMFYgPm', 'pay_CAhw8tH16iW0nx', 196, 'Royal enfield thunderbird x350', 21, 'Journey Wheels Office', '23/03/2019 11:30', '  Journey Wheels Office', '23/03/2019 16:30', '1', '2019-03-23 05:06:29', '682.6', 'durgabhaskara446@gmail.com', '9949776822', 'Bhaskar', '650.0', '16.3', '16.3', 1),
(244, 'order_CAkadZOyZujoVD', 'pay_CAkbeQ4hZrd8Zw', 381, 'HONDA ACTIVA 5G', 90, 'Journey Wheels Office', '23/03/2019 13:10', '  Journey Wheels Office', '24/03/2019 13:10', '2', '2019-03-23 07:45:13', '377.1', 'akshay7india@gmail.com', '9701701309', 'Akshay reddy', '399.0', '10.0', '10.0', 1),
(245, 'order_CAnNkOR9BL3osT', 'pay_CAnPSPo65ZPpCX', 383, 'HONDA ACTIVA 5G', 90, 'Bus Stand', '23/03/2019 15:52', '  Bus Stand', '24/03/2019 14:52', '2', '2019-03-23 10:27:40', '419', 'sumitaggarwal02@gmail.com', '9992121226', 'Sumit Agarwal', '399.0', '10.0', '10.0', 1),
(246, 'order_CAoPI4VZ28CYM9', 'pay_CAoQ2924JIs1zu', 0, 'KTM DUKE 200 CC', 85, 'Bus Stand', '23/03/2019 17:30', '  Bus Stand', '23/03/2019 22:30', '1', '2019-03-23 11:27:10', '630', '', '', '', '600.0', '15.0', '15.0', 1),
(247, 'order_CAsUziLmW5PKyb', 'pay_CAsWDAEt2NspYR', 384, 'RE THUNDERBIRD X350', 77, 'Journey Wheels Office', '23/03/2019 20:55', '  Journey Wheels Office', '24/03/2019 20:55', '2', '2019-03-23 15:27:58', '1322.1', 'vallapuyashwanth496@gmail.com', '9963005379', 'Vallapu yashwanth', '1399.0', '35.0', '35.0', 1),
(248, 'order_CB1hMQV43BpglW', 'pay_CB1htRPvS8X0kM', 386, 'HONDA ACTIVA 5G', 79, 'Journey Wheels Office', '24/03/2019 05:49', '  Journey Wheels Office', '25/03/2019 05:49', '1', '2019-03-24 00:27:05', '424.26', 'ganeshsmartyz2762@gmail.com', '7793900119', 'Ganesh devarapu', '449.0', '11.2', '11.2', 1),
(249, 'order_CB2LRP3oKVLHc9', 'pay_CB2M6xW5sdpXSY', 387, 'HONDA ACTIVA 5G', 79, 'Bus Stand', '24/03/2019 08:30', '  Bus Stand', '24/03/2019 16:00', '1', '2019-03-24 01:05:38', '318.24', 'sandeepvattikuti8055@gmail.com', '9611183999', 'Sandeep', '336.8', '8.4', '8.4', 1),
(250, 'order_CB55H4AcqmZmBu', 'pay_CB56VwZG9z23Vp', 391, 'Suziki Access 125', 63, 'Journey Wheels Office', '24/03/2019 10:00', '  Bus Stand', '24/03/2019 22:58', '2', '2019-03-24 03:46:23', '396.9', 'nag.lakkimsetti@gmail.com', '9618246777', 'Mani Kumar', '420.0', '10.5', '10.5', 1),
(251, 'order_CB5GUBrczxbSBk', 'pay_CB5GrTisSMPgzX', 392, 'Yamaha FZ 150', 39, 'Journey Wheels Office', '24/03/2019 09:21', '  Journey Wheels Office', '25/03/2019 09:21', '1', '2019-03-24 03:57:37', '708.84', 'gunavanthtejavath.3@gmail.com', '7675074374', 'Gunavanth', '750.0', '18.8', '18.8', 1),
(252, 'order_CB5aQJ5V4DJJx7', 'pay_CB5b8IOs0EjB41', 65, 'Bajaj Pulsar 150cc', 43, 'Journey Wheels Office', '24/03/2019 09:47', '  Journey Wheels Office', '25/03/2019 09:48', '1', '2019-03-24 04:15:21', '615.33', 'ashokkopparapu999@gmail.com', '8125474799', 'Ashok', '651.1', '16.3', '16.3', 1),
(253, 'order_CB5dD3ywgNAOvp', 'pay_CB5dvudQ2esQ2O', 65, 'Royal Enfield Classic 350', 40, 'Journey Wheels Office', '24/03/2019 09:50', '  Journey Wheels Office', '25/03/2019 09:50', '1', '2019-03-24 04:18:06', '1134', 'ashokkopparapu999@gmail.com', '8125474799', 'Ashok', '1200.0', '30.0', '30.0', 1),
(254, 'order_CB8DKlazqmdvVd', 'pay_CB8FudMYkLp57G', 50, 'Yamaha FZ 150', 15, 'Journey Wheels Office', '24/03/2019 12:17', '  Journey Wheels Office', '19/06/2019 12:18', '2', '2019-03-24 06:52:42', '60108.77', 'sairamkatakam999@gmail.com', '8977770505', 'Sairamkatakam', '121801.0', '3045.0', '3045.0', 1),
(255, 'order_CBEgBgCc5C2xTQ', 'pay_CBEh6NRxkrNUS0', 398, 'HONDA ACTIVA 5G', 79, 'Railway Station', '24/03/2019 18:36', '  Railway Station', '25/03/2019 15:30', '1', '2019-03-24 13:09:20', '424.26', 'aqilbasha786@gmail.com', '9885178666', 'Aqil basha', '449.0', '11.2', '11.2', 1),
(256, 'order_CBFaebYPwDgk05', 'pay_CBFb9Ho0aCVTTF', 376, 'KTM DUKE 250CC', 76, 'Journey Wheels Office', '24/03/2019 19:30', '  Journey Wheels Office', '25/03/2019 19:30', '2', '2019-03-24 14:02:14', '1337.9', 'suri.it.2000@gmail.com', '7997526124', 'SURESH', '1499.0', '37.5', '37.5', 1),
(257, 'order_CBW3HPQlkPmRue', 'pay_CBW3hdQaIiMVXv', 392, 'KTM DUKE 200 CC', 85, 'Journey Wheels Office', '25/03/2019 11:33', '  Journey Wheels Office', '26/03/2019 11:33', '1', '2019-03-25 06:09:11', '1134', 'gunavanthtejavath.3@gmail.com', '7675074374', 'Gunavanth', '1200.0', '30.0', '30.0', 1),
(258, 'order_CBWf9sus0NT0jh', 'pay_CBWfYrAk6Kkevp', 191, 'Jupiter classic', 38, 'Journey Wheels Office', '17/03/2019 15:30', '  Journey Wheels Office', '25/03/2019 15:30', '1', '2019-03-25 06:44:39', '3394.44', 'munna9ravi59@gmail.com', '7036215434', 'Raviteja', '3592.0', '89.8', '89.8', 1),
(259, 'order_CBfHrnyCvlLNPY', 'pay_CBfIhzRGeCJqzj', 402, 'JUPITER CLASSIC', 68, 'NAD Junction', '26/03/2019 10:33', '  NAD Junction', '27/03/2019 10:33', '5', '2019-03-25 15:10:48', '453.6', 'phanivardhan6666@gmail.com', '9866631069', 'KANTUMUCHI SRI PHANI VARDHAN', '432.0', '10.8', '10.8', 1),
(260, 'order_CBhKbWNpAtUJAf', 'pay_CBhM4MakVdEWmS', 153, 'Yamaha Rayzr', 37, 'Journey Wheels Office', '29/03/2019 18:00', '  Journey Wheels Office', '30/03/2019 18:00', '1', '2019-03-25 17:11:25', '471.4', 'chaitanyakillada9@gmail.com', '7287812529', 'Chaitanya', '449.0', '11.2', '11.2', 1),
(261, 'order_CD97SblC65LnIU', 'pay_CD98RviVs753w6', 50, 'Jupiter', 9, 'Journey Wheels Office', '29/03/2019 14:28', '  Journey Wheels Office', '30/03/2019 14:28', '2', '2019-03-29 09:02:43', '377.1', 'sairamkatakam999@gmail.com', '8977770505', 'Sairamkatakam', '399.0', '10.0', '10.0', 1),
(262, 'order_CDAlgUEhFn06dO', 'pay_CDB0aLOFILnbSZ', 413, 'HONDA ACTIVA 5G', 90, 'Bus Stand', '02/04/2019 14:02', '  Bus Stand', '05/04/2019 14:00', '2', '2019-03-29 10:51:32', '1131.12', 'friends.brahmaji@gmail.com', '09940429263', 'Brahmaji Alla rudhra', '1197.0', '29.9', '29.9', 1),
(263, 'order_CDVFGvW9UGv7c7', 'pay_CDVG3Lhv22ZflU', 415, 'Yamaha Rayzr', 37, 'Bus Stand', '31/03/2019 08:30', '  Bus Stand', '31/03/2019 20:30', '1', '2019-03-30 06:39:54', '424.26', 'rajaratnakarvuyyuru@yahoo.com', '9502886315', 'raj', '449.0', '11.2', '11.2', 1),
(264, 'order_CDWNh7YNLnjLJp', 'pay_CDWOiWBfD6zhfM', 421, 'Jupiter classic', 38, 'Bus Stand', '30/03/2019 19:30', '  Bus Stand', '31/03/2019 07:30', '1', '2019-03-30 07:46:35', '424.26', 'chaitukakula@gmail.com', '9182490055', 'Chaitanya', '449.0', '11.2', '11.2', 1),
(265, 'order_CDrigHGfwicjmd', 'pay_CDrrQIrpjvJszz', 424, 'Royal Enfield Classic 350', 40, 'Journey Wheels Office', '31/03/2019 11:30', '  Journey Wheels Office', '31/03/2019 17:30', '1', '2019-03-31 04:46:13', '680.4', 'rahulsmart273@gmail.com', '9182519215', 'Rahul', '720.0', '18.0', '18.0', 1),
(266, 'order_CE2BhJn7rZbhpq', 'pay_CE2EZw2toBmbwF', 426, 'Royal Enfield Classic 350', 40, 'Journey Wheels Office', '01/04/2019 07:22', '  Journey Wheels Office', '02/04/2019 07:22', '1', '2019-03-31 14:54:54', '1134', 'rajasekharreddy229@gmail.com', '9441235265', 'Rajasekhara reddy', '1200.0', '30.0', '30.0', 1),
(267, 'order_CECeXRXfBfjFXq', 'pay_CEChh54j4mxQXe', 428, 'HONDA ACTIVA 5G', 90, 'Railway Station', '01/04/2019 06:45', '  Railway Station', '01/04/2019 23:57', '2', '2019-04-01 01:09:22', '419', 'lifegooday@gmail.com', '9985932749', 'Gudavalli ramakrishnasarma', '399.0', '10.0', '10.0', 1),
(268, 'order_CEHDCmoAhpHd6i', 'pay_CEHEDf8kIPU5SH', 431, 'Yamaha Rayzr', 37, 'Journey Wheels Office', '01/04/2019 10:58', '  Journey Wheels Office', '01/04/2019 17:01', '1', '2019-04-01 05:35:13', '256.68', 'sudharshan868@gmail.com', '9538763397', 'Y Venkata Sudharshan', '271.6', '6.8', '6.8', 1),
(269, 'order_CEPopsUOtOe38p', 'pay_CEQ26swWUvWs3x', 430, 'Jupiter classic', 38, 'Journey Wheels Office', '30/03/2019 10:00', '  Journey Wheels Office', '01/04/2019 19:00', '1', '2019-04-01 14:11:50', '1400.13', 'vijayvj23459@gmail.com', '9505965555', 'Vijay Bhaskar Reddy', '1481.7', '37.0', '37.0', 1),
(270, 'order_CERSwYDcl4voHh', 'pay_CERTb1umMYIEtK', 432, 'HONDA ACTIVA 5G', 90, 'Bus Stand', '01/04/2019 20:58', '  Bus Stand', '02/04/2019 14:59', '2', '2019-04-01 15:37:11', '377.1', 'annapaneniashok@gmail.com', '9008729111', 'A ASHOK KUMAR', '399.0', '10.0', '10.0', 1),
(271, 'order_CEcSL5uVCbPjw4', 'pay_CEcThooqsgZETu', 433, 'Jupiter classic', 38, 'Railway Station', '02/04/2019 09:43', '  Railway Station', '03/04/2019 06:43', '1', '2019-04-02 02:22:17', '471.4', 'bharatmarketing2012@gmail.com', '9840637198', 'Pankaj', '449.0', '11.2', '11.2', 1),
(272, 'order_CEdMJWwFutyPD8', 'pay_CEdPm70iQIxtYJ', 435, 'Yamaha FZ25', 14, 'Journey Wheels Office', '02/04/2019 09:00', '  Journey Wheels Office', '02/04/2019 23:31', '2', '2019-04-02 03:19:14', '840', 'sravan.inapuri1991@gmail.com', '7013655874', 'Sravan Inapuri', '1000.0', '25.0', '25.0', 1),
(273, 'order_CEfR0JFsJVu4AU', 'pay_CEfUnfVfPg2Q6e', 436, 'KTM DUKE 200 CC', 85, 'Journey Wheels Office', '02/04/2019 10:39', '  Journey Wheels Office', '02/04/2019 16:39', '1', '2019-04-02 05:19:24', '756', 'venkatbathina1@gmail.com', '7386639880', 'Venkat', '720.0', '18.0', '18.0', 1),
(274, 'order_CEkOxysaKikq9B', 'pay_CEkPN8RW5IzadB', 191, 'HONDA ACTIVA 5G', 79, 'Journey Wheels Office', '25/03/2019 15:30', '  Journey Wheels Office', '02/04/2019 15:30', '1', '2019-04-02 10:08:10', '3394.44', 'munna9ravi59@gmail.com', '7036215434', 'Raviteja', '3592.0', '89.8', '89.8', 1),
(275, 'order_CExlECCwx6lp6c', 'pay_CExmFtqIlmV3IB', 322, 'Yamaha Rayzr', 37, 'Railway Station', '03/04/2019 10:30', '  Railway Station', '04/04/2019 13:00', '1', '2019-04-02 23:12:23', '530.37', 'chaitanyagoru@ymail.com', '9000388028', 'Chaitanya Goru', '561.3', '14.0', '14.0', 1),
(276, 'order_CEzJJExnljtssp', 'pay_CEzLxqjbI7DOhM', 438, 'Aprilia 150cc ', 7, 'Railway Station', '03/04/2019 06:20', '  Bus Stand', '04/04/2019 10:01', '2', '2019-04-03 00:47:32', '617.8', 'Singupurapupradeep@gmail.com', '9573416531', 'Pradeep Singupurapu', '588.4', '14.7', '14.7', 1),
(277, 'order_CF3HTDeEIdky9Q', 'pay_CF3J93hFI724YT', 440, 'Jupiter', 9, 'Journey Wheels Office', '03/04/2019 10:02', '  Journey Wheels Office', '03/04/2019 16:00', '2', '2019-04-03 04:36:55', '250.1', 'gangatraju@gmail.com', '8712302506', 'T GANGARAJU', '238.1', '6.0', '6.0', 1),
(278, 'order_CF7LWRPgxDKfw5', 'pay_CF7NlCbFjBTAOc', 441, 'THUNDERBIRD X350', 98, 'Journey Wheels Office', '03/04/2019 13:59', '  Journey Wheels Office', '05/04/2019 13:59', '2', '2019-04-03 08:36:03', '2646', 'manimani9603025430@gmail.com', '9603025430', 'Manikanth Reddy G', '2800.0', '70.0', '70.0', 1),
(282, 'order_CFCyaDZljDuuat', 'pay_CFCzQDA3iBnhOG', 443, 'HONDA ACTIVA 5G', 79, 'Railway Station', '03/04/2019 19:33', '  Railway Station', '04/04/2019 19:33', '1', '2019-04-03 14:05:11', '424.26', 'yeshuyeshwanth413@gmail.com', '9618733313', 'Yeshu Trozen', '449.0', '11.2', '11.2', 1),
(283, 'order_CFDoFVnm9BuxBV', 'pay_CFDqR4qhMlzXwj', 433, 'Jupiter classic', 38, 'Journey Wheels Office', '03/04/2019 21:45', '  Railway Station', '04/04/2019 19:30', '1', '2019-04-03 14:55:56', '424.26', 'bharatmarketing2012@gmail.com', '9840637198', 'Pankaj', '449.0', '11.2', '11.2', 1),
(284, 'order_CFJ5dke2drp5bu', 'pay_CFJ7KdefHdZgGw', 0, 'Jupiter classic', 38, 'Bus Stand', '04/04/2019 11:00', '  Bus Stand', '05/04/2019 03:30', '1', '2019-04-03 20:04:58', '471.4', '', '', '', '449.0', '11.2', '11.2', 1),
(285, 'order_CFY9QoYy3PLLbc', 'pay_CFYDoVP04aKdbS', 327, 'Yamaha FZ 150', 15, 'Journey Wheels Office', '04/04/2019 16:15', '  Journey Wheels Office', '07/04/2019 16:15', '2', '2019-04-04 10:52:08', '1984.5', 'tejasurya213@gmail.com', '8309987128', 'Surya', '2100.0', '52.5', '52.5', 1),
(286, 'order_CFbfW9hVq3EAHq', 'pay_CFbhNnPxTLolxK', 439, 'JUPITER CLASSIC', 68, 'Journey Wheels Office', '07/04/2019 09:30', '  Journey Wheels Office', '08/04/2019 12:00', '5', '2019-04-04 14:15:35', '567', 'nivedhannaveen@gmail.com', '9753951858', 'Nivedhan Naveen', '540.0', '13.5', '13.5', 1),
(287, 'order_CFpHzhcJi0hGYJ', 'pay_CFpJiDf5XYp2yL', 216, 'Yamaha Rayzr', 37, 'Journey Wheels Office', '05/04/2019 09:30', '  Journey Wheels Office', '05/04/2019 15:30', '1', '2019-04-05 03:35:36', '254.52', 'sumanth.friend2u@gmail.com', '09652166555', 'K Teja suman', '269.4', '6.7', '6.7', 1),
(288, 'order_CG4ikGrOqNLgtK', 'pay_CG4jJkw3bwu0nq', 443, 'HONDA ACTIVA 5G', 73, 'Railway Station', '04/04/2019 00:07', '  Railway Station', '06/04/2019 00:07', '1', '2019-04-05 18:40:20', '848.7', 'yeshuyeshwanth413@gmail.com', '9618733313', 'Yeshu Trozen', '898.0', '22.5', '22.5', 1),
(289, 'order_CG4vwcnr45ymNE', 'pay_CG57HKBeL7FzEm', 451, 'YAMAHA FASCINO', 97, 'Railway Station', '06/04/2019 08:30', '  Railway Station', '06/04/2019 19:53', '1', '2019-04-05 19:02:21', '414.9', 'sg69394@gmail.com', '09951649737', 'Padilam Gowri shankar', '439.0', '11.0', '11.0', 1),
(290, 'order_CGE5o4ECWgLSM8', 'pay_CGE6nYJDOFEH9O', 121, 'Jupiter classic', 38, 'Bus Stand', '06/04/2019 16:30', '  Bus Stand', '07/04/2019 16:30', '1', '2019-04-06 03:50:08', '424.26', 'sampath_44online@yahoo.co.in', '6305898388', 'Sampath', '449.0', '11.2', '11.2', 1),
(291, 'order_CGFLkCzz6PXFCb', 'pay_CGFMn90xj5XtQk', 0, 'Yamaha FZ 150', 15, 'Journey Wheels Office', '06/04/2019 21:00', '  Journey Wheels Office', '07/04/2019 21:00', '2', '2019-04-06 05:03:39', '735', '', '', '', '700.0', '17.5', '17.5', 1),
(292, 'order_CGeTbjRyFgSgYW', 'pay_CGeYMivARsayOm', 462, 'HONDA ACTIVA 5G', 73, 'Journey Wheels Office', '07/04/2019 11:06', '  Bus Stand', '07/04/2019 21:06', '1', '2019-04-07 05:42:15', '424.26', 'vinoth.kannanspcl@gmail.com', '09986796073', 'vinoth kannan', '449.0', '11.2', '11.2', 1),
(293, 'order_CH15S606RquZKJ', 'pay_CH15rBGwPjUewg', 465, 'HONDA ACTIVA 5G', 73, 'Railway Station', '08/04/2019 14:30', '  Bus Stand', '09/04/2019 19:00', '1', '2019-04-08 03:45:33', '615.33', 'dvnaresh91@gmail.com', '8790548661', 'DOPPA VENKATA NARESH', '651.1', '16.3', '16.3', 1),
(294, 'order_CH1VDyztD7Sm6a', 'pay_CH1WRVr2PzAgXL', 238, 'Suziki Access 125', 63, 'Journey Wheels Office', '08/04/2019 09:36', '  Journey Wheels Office', '10/04/2019 09:30', '2', '2019-04-08 04:10:31', '793.8', 'chandra_reddys@yahoo.in', '9391789660', 'Chandra sekhar', '840.0', '21.0', '21.0', 1),
(295, 'order_CH2athym9gnFUb', 'pay_CH2cTfJweWYOeX', 467, 'HONDA ACTIVA 5G', 73, 'Bus Stand', '08/04/2019 10:40', '  Bus Stand', '09/04/2019 10:41', '1', '2019-04-08 05:15:39', '472.1', 'chandu.karusala17@gmail.com', '9980873232', 'Chandu', '449.7', '11.2', '11.2', 1),
(296, 'order_CH5V1yfV6CAxiV', 'pay_CH5VUBnyUKkg7R', 392, 'TVS Apache', 42, 'Journey Wheels Office', '08/04/2019 13:30', '  Journey Wheels Office', '09/04/2019 13:30', '1', '2019-04-08 08:04:59', '735', 'gunavanthtejavath.3@gmail.com', '7675074374', 'Gunavanth', '700.0', '17.5', '17.5', 1),
(297, 'order_CH5dGe7gOJ1CXh', 'pay_CH5dhco4P9iePg', 469, 'Jupiter classic', 38, 'Railway Station', '08/04/2019 18:00', '  Railway Station', '11/04/2019 18:00', '1', '2019-04-08 08:12:54', '1272.96', 'gouse.zk@gmail.com', '8296195197', 'khaza gouse', '1347.0', '33.7', '33.7', 1),
(298, 'order_CHBVvHX8iUzN7L', 'pay_CHBYDvvs7sSq0C', 479, 'Yamaha Fz 3.0', 86, 'Journey Wheels Office', '09/04/2019 06:30', '  Journey Wheels Office', '10/04/2019 06:30', '5', '2019-04-08 13:59:04', '861', 'indianfbidjjr@gmail.com', '7013849754', 'Duli John Joseph raju', '820.0', '20.5', '20.5', 1),
(299, 'order_CHUeBGFQMOvRkN', 'pay_CHUewgISjNntqE', 88, 'Suziki Access 125', 63, 'Journey Wheels Office', '09/04/2019 16:08', '  Journey Wheels Office', '10/04/2019 16:08', '2', '2019-04-09 08:41:28', '441', 'abhinavrocky99@gmail.com', '9989191434', 'Abhinav Sai', '420.0', '10.5', '10.5', 1),
(300, 'order_CHloXAsDjD4HAt', 'pay_CHls7IUqlGGCzG', 483, 'Aprilia 150cc ', 7, 'Bus Stand', '10/04/2019 07:30', '  Railway Station', '10/04/2019 23:55', '2', '2019-04-10 01:30:34', '451.6', 'goforsagarb@gmail.com', '9834547546', 'Sagar', '430.0', '10.8', '10.8', 1),
(301, 'order_CHmnvkWL5owZG0', 'pay_CHms7EIU0sGDIe', 484, 'Aprilia 150cc ', 7, 'Bus Stand', '10/04/2019 07:51', '  Railway Station', '10/04/2019 23:57', '2', '2019-04-10 02:33:00', '406.44', 'kan.capital001@gmail.com', '8328602058', 'Tj', '430.0', '10.8', '10.8', 1),
(302, 'order_CHsE3WHuVJ1BXr', 'pay_CHsLJzlIlIIC4Z', 486, 'Yamaha FZ 150', 39, 'Journey Wheels Office', '10/04/2019 14:00', '  Journey Wheels Office', '11/04/2019 14:00', '1', '2019-04-10 07:51:34', '708.84', 'manikantamummadisetti9@gmail.com', '8317502789', 'Mummadisetti Manikanta', '750.0', '18.8', '18.8', 1),
(303, 'order_CHxH17X36buLq7', 'pay_CHxJMUXZ9NlBVR', 487, 'Bajaj Pulsar 150cc', 43, 'Bus Stand', '10/04/2019 18:00', '  Bus Stand', '12/04/2019 03:00', '1', '2019-04-10 12:42:13', '1167.12', 'vijaysrisai.vempatapu@gmail.com', '8309898171', 'Vijay Sri sai', '1235.0', '30.9', '30.9', 1),
(304, 'order_CIHJjrXU4lOqYr', 'pay_CIHNWLPRUWVknT', 486, 'Yamaha FZ 150', 39, 'Journey Wheels Office', '11/04/2019 14:00', '  Journey Wheels Office', '12/04/2019 14:00', '1', '2019-04-11 08:19:53', '708.84', 'manikantamummadisetti9@gmail.com', '8317502789', 'Mummadisetti Manikanta', '750.0', '18.8', '18.8', 1),
(305, 'order_CIIFAb0xvnPNXE', 'pay_CIIFyf885N3Ofy', 467, 'ACCESS 125', 70, 'Journey Wheels Office', '10/04/2019 12:39', '  Journey Wheels Office', '12/04/2019 12:39', '1', '2019-04-11 09:12:17', '848.7', 'chandu.karusala17@gmail.com', '9980873232', 'Chandu', '898.0', '22.5', '22.5', 1),
(306, 'order_CIJTMsstoH329x', 'pay_CIJUmTRwwYcSeK', 489, 'Jupiter', 9, 'Journey Wheels Office', '11/04/2019 17:30', '  Journey Wheels Office', '11/04/2019 22:30', '2', '2019-04-11 10:24:22', '209.5', 'pushyapunith007@gmail.com', '8333051799', 'Pushyamithra', '199.5', '5.0', '5.0', 1),
(307, 'order_CIM42miejfnkVS', 'pay_CIM4o0E1FdcNCN', 136, 'HONDA ACTIVA 5G', 73, 'Bus Stand', '11/04/2019 19:30', ' Bus Stand', '14/04/2019 19:30', '1', '2019-04-11 12:55:41', '1272.96', 'er.abhinesh@gmail.com', '9500416116', 'Abhinesh Parthasarathy', '1347.0', '33.7', '33.7', 1),
(308, 'order_CINSVJHdGVE4ao', 'pay_CINUDqodIW5SKJ', 490, 'HONDA ACTIVA 5G', 73, 'Journey Wheels Office', '11/04/2019 19:30', '  Journey Wheels Office', '12/04/2019 19:30', '1', '2019-04-11 14:18:36', '424.26', 'sasichowdary009@gmil.com', '9912194784', 'Sasi Kumar', '449.0', '11.2', '11.2', 1),
(309, 'order_CIaOeGqN64qm5z', 'pay_CIaP2Bp9WOx3lC', 392, 'HONDA ACTIVA 5G', 73, 'Journey Wheels Office', '12/04/2019 07:03', '  Journey Wheels Office', '13/04/2019 07:03', '1', '2019-04-12 02:57:10', '471.4', 'gunavanthtejavath.3@gmail.com', '7675074374', 'Gunavanth', '449.0', '11.2', '11.2', 1),
(310, 'order_CIgkDKo92V3pvx', 'pay_CIgkzzOBHxk93y', 491, 'ACCESS 125', 70, 'Journey Wheels Office', '12/04/2019 14:37', '  Railway Station', '13/04/2019 14:37', '1', '2019-04-12 09:09:21', '424.26', 'ryarravarapu@gmail.com', '8790879292', 'Rajesh Yarravarapu', '449.0', '11.2', '11.2', 1),
(311, 'order_CIhieEwRSLzp3B', 'pay_CIhj8BlPr9UVkL', 486, 'Yamaha FZ 150', 39, 'Journey Wheels Office', '12/04/2019 15:40', '  Journey Wheels Office', '13/04/2019 15:40', '1', '2019-04-12 10:06:40', '787.6', 'manikantamummadisetti9@gmail.com', '8317502789', 'Mummadisetti Manikanta', '750.0', '18.8', '18.8', 1),
(312, 'order_CImK9GLN7YKyXp', 'pay_CImKrybANCZRFh', 466, 'Bajaj Pulsar 150cc', 43, 'Bus Stand', '13/04/2019 09:50', '  Bus Stand', '14/04/2019 20:50', '1', '2019-04-12 14:38:59', '1228.5', 'parvathiniravikumar@gmail.com', '9959077633', 'Parvathini Ravi Kumar', '1300.0', '32.5', '32.5', 1),
(313, 'order_CJ0x48JAo3N2qk', 'pay_CJ0xnZU06AQIA7', 490, 'HONDA ACTIVA 5G', 73, 'Journey Wheels Office', '13/04/2019 10:30', '  Journey Wheels Office', '14/04/2019 10:30', '1', '2019-04-13 04:55:26', '424.26', 'sasichowdary009@gmil.com', '9912194784', 'Sasi Kumar', '449.0', '11.2', '11.2', 1),
(314, 'order_CJCaCEbr8I6d58', 'pay_CJCagIC8jgHTdd', 467, 'ACCESS 125', 70, 'Journey Wheels Office', '14/04/2019 08:45', '  Journey Wheels Office', '15/04/2019 08:45', '1', '2019-04-13 16:18:38', '424.26', 'chandu.karusala17@gmail.com', '9980873232', 'Chandu', '449.0', '11.2', '11.2', 1),
(315, 'order_CJMHpuq6TIs7Be', 'pay_CJMNR7qfp6loJh', 494, 'Jupiter', 9, 'Bus Stand', '14/04/2019 08:01', '  Railway Station', '14/04/2019 15:15', '2', '2019-04-14 01:52:11', '303', 'vijay.tamanampudi@gmail.com', '9703688400', 'Vijay', '288.6', '7.2', '7.2', 1),
(316, 'order_CJWJK2hHKXvKxq', 'pay_CJWKqQ19utQZZg', 496, 'HONDA ACTIVA 5G', 73, 'Bus Stand', '18/04/2019 09:30', '  Bus Stand', '21/04/2019 21:30', '1', '2019-04-14 11:37:37', '1697.22', 'ashokkumariitp@gmail.com', '9110304253', 'Ashok Kumar', '1796.0', '44.9', '44.9', 1),
(317, 'order_CJZ5GXr64yltqe', 'pay_CJZ9izn5mDVs9I', 443, 'HONDA ACTIVA 5G', 73, 'Railway Station', '14/04/2019 20:46', '  Railway Station', '15/04/2019 19:46', '1', '2019-04-14 14:22:17', '424.26', 'yeshuyeshwanth413@gmail.com', '9618733313', 'Yeshu Trozen', '449.0', '11.2', '11.2', 1),
(318, 'order_CJZwFVx7O61bFR', 'pay_CJZwrKimaQRL4V', 497, 'HONDA ACTIVA 5G', 90, 'Journey Wheels Office', '14/04/2019 20:34', '  Journey Wheels Office', '15/04/2019 20:34', '2', '2019-04-14 15:09:38', '377.1', 'jay.successor@gmail.com', '8248659154', 'Mritunjay', '399.0', '10.0', '10.0', 1),
